"ArticleUrl";"Type";"Title";"Intro";"Heading";"PublishDate";"Style";"IsPlus";"filename"
"https://www.spiegel.de/reise/packrafting-ausruestungen-touren-tipps-erst-rucksack-dann-kajak-dann-abenteuer-a-84d38afc-21ca-4c25-b2dc-9f7dc41adadc";"highlight";"Erst Rucksack, dann Kajak, dann Abenteuer";"Wandern und Paddeln zu kombinieren, das war lange ein Traum vieler Outdoorfans. Mit dem Packraft geht das. Es ermöglicht völlig neue Abenteuer - gern auch vor der Haustür.";"Packrafting";2020-07-01 12:53:47;"default";FALSE;"no211_highlight_free_2020-07-01H12-53-47.png"
"https://www.spiegel.de/wirtschaft/unternehmen/arbeitsbedingungen-in-schlachthoefen-eiweissporno-in-der-schmuddelecke-der-gesellschaft-a-2226cc38-7772-40e3-afd6-8977e9bab0ff";"opinion";"Eiweißporno in der Schmuddelecke der Gesellschaft";"Jetzt empören sich wieder alle über die Sklavenarbeit in den Fleischfabriken. Dabei sollte  jedem längst klar sein, wie grausam es dort zugeht. Warum sonst findet ihr Geschäft am Rand der Gesellschaft statt?";"Tabuzone Schlachthof";2020-06-20 14:15:28;"default";FALSE;"no212_opinion_free_2020-06-20H14-15-28.png"
"https://www.spiegel.de/harvard/fuehrung/otto-group-alexander-birken-ueber-den-digitalen-kulturwandel-bei-otto-a-00000000-0002-0001-0000-000162831752";"highlight";"\"\"Die Alternative war die Insolvenz\"\"";"Der Einzelhandelsriese Otto Group hat sich vor drei Jahren einen gewaltigen Kulturwandel verordnet – hin zu einem rundum digitalisierten Unternehmen. Auch der technikaffine Vorstandschef Alexander Birken musste an sich arbeiten. Ein Gespräch über Fuck-up-Nights, widerspenstige Mitarbeiter und den Abschied vom legendären Otto-Katalog.";"Otto-CEO Alexander Birken";2020-06-18 07:35:05;"default";FALSE;"no213_highlight_free_2020-06-18H07-35-05.png"
"https://www.spiegel.de/auto/fahrkultur/atnmbl-studie-von-mike-and-maaike-der-fahrende-wohnzimmer-a-be3c6ef0-c618-43e1-bdef-92b232b208b6";"news";"Ich geb Glas, ich hab Spaß";"Die Automobilgeschichte ist voll von irren Studien, die erst begeisterten und dann verschwanden. Wie das autonom fahrende Projekt ATNMBL - ein kleiner Wintergarten auf Rädern.";"Schönes Ding: ATNMBL";2020-07-12 05:58:58;"default";FALSE;"no214_news_free_2020-07-12H05-58-58.png"
"https://www.spiegel.de/panorama/leute/charlize-theron-erklaert-ihren-kindern-rassismus-notwendigkeit-gesehen-es-anzusprechen-a-f3fff8f4-513b-4136-8a66-524c25cef90f";"news";"\"\"Ich habe die Notwendigkeit gesehen, es anzusprechen\"\"";"Charlize Theron ist Mutter von zwei schwarzen Kindern. Auch wenn sie noch jung sind, hat sie nach dem Tod von George Floyd mit ihnen darüber gesprochen, was in den USA derzeit vor sich geht.";"Charlize Theron erklärt ihren Kindern Rassismus";2020-07-10 17:24:52;"default";FALSE;"no215_news_free_2020-07-10H17-24-52.png"
"https://www.spiegel.de/stil/anna-wintour-vogue-chefin-im-homeofficelook-a-e76fa07f-34bb-4446-9a7a-adf7b4c6f77d";"highlight";"Vornehm geht die Welt zugrunde";"\"\"Vogue\"\"-Überfrau Anna Wintour hat sich im Homeoffice fotografieren lassen. Von dem Bild lässt sich einiges lernen - über Understatement und Haltung.";"\"\"Vogue\"\"-Chefin im Homeofficelook";2020-04-14 17:27:00;"default";FALSE;"no216_highlight_free_2020-04-14H17-27-00.png"
"https://www.spiegel.de/kultur/matthias-lilienthal-hoert-an-den-muenchner-kammerspielen-auf-die-hoehen-und-tiefen-waren-extrem-a-2249283c-d763-4619-922f-44c0f9edb352";"news";"\"\"Ich bin kein Märtyrer. Ich bin ein sehr fröhlicher Mensch\"\"";"Matthias Lilienthal wollte als Intendant an den Münchner Kammerspielen vieles anders machen - und wurde dafür gelobt, aber auch scharf kritisiert. Jetzt geht er nach nur einer Amtszeit. Was bleibt?";"Umstrittener Theatermacher zieht Bilanz";2020-07-11 14:03:13;"default";FALSE;"no217_news_free_2020-07-11H14-03-13.png"
"https://www.spiegel.de/kultur/japan-kunstausstellung-in-tokio-nach-wenigen-minuten-komplett-gepluendert-a-9fe433c2-5da9-400e-9e75-f115e96330ef";"news";"Ausstellung in Tokio komplett geplündert";"Zehn Tage lang sollte die Ausstellung öffnen - doch nach nur wenigen Minuten waren alle Exponate weg. Geklaut von Hunderten Besuchern. Und das durften die sogar.";"Kunstaktion in Japan";2020-07-12 10:25:00;"default";FALSE;"no218_news_free_2020-07-12H10-25-00.png"
"https://www.spiegel.de/politik/ausland/saeb-erekat-deutschland-soll-israels-geplante-annexion-verhindern-a-d101c26c-048c-48a7-b6f1-4ce60179dc2f";"news";"\"\"Ich werde mich mit solchen Leuten nicht an einen Tisch setzen\"\"";"Der palästinensische Chefunterhändler Saeb Erekat fordert Deutschland auf, mehr zu tun, um Israels geplante Annexion des Westjordanlandes zu verhindern.";"Nahostkonflikt";2020-07-10 13:59:00;"default";FALSE;"no219_news_free_2020-07-10H13-59-00.png"
"https://www.spiegel.de/psychologie/man-muss-die-leute-zu-komplizen-machen-a-8d2a1301-9e34-4a2f-b672-ca52690e6d12";"highlight";"\"\"Man muss die Leute zu Komplizen machen\"\"";"Nicht durch restriktive Maßnahmen, sondern nur durch Überzeugungskraft kann man gesellschaftliche Regeln nachhaltig ändern, sagt der Sozialpsychologe Klaus Fiedler.";"Wann Menschen ihr Verhalten ändern";2020-05-19 18:18:00;"default";FALSE;"no220_highlight_free_2020-05-19H18-18-00.png"
"https://www.manager-magazin.de/politik/weltwirtschaft/coronavirus-15-000-neuinfektionen-florida-bricht-kaliforniens-corona-rekord-a-722aebc1-0aa4-46c4-a5f7-3eb1eeb8e748";"news";"Florida bricht Kaliforniens Corona-Rekord";"Der US-Staat Florida ragt unter den neuen Corona-Hotspots der USA heraus. Das Tempo, mit dem sich die Seuche ausbreitet, stellt den bisherigen tragischen Rekord in den Schatten.";"Mehr als 15.000 Neuinfektionen";2020-07-13 10:47:11;"default";FALSE;"no221_news_free_2020-07-13H10-47-11.png"
"https://www.spiegel.de/stil/s-magazin/microdosing-statt-kaffee-lieber-eine-kleine-dosis-lsd-a-00000000-0002-0001-0000-000170854053";"highlight";"Statt Kaffee lieber eine kleine Dosis LSD";"Auf der Suche nach dem besseren Ich greifen Menschen wieder zu psychedelischen Drogen. Und auch Depressive hoffen auf Heilung durch bewusstseinserweiternde Substanzen.";"Microdosing von Psychedelika";2020-06-21 15:06:18;"default";FALSE;"no222_highlight_free_2020-06-21H15-06-18.png"
"https://www.spiegel.de/politik/ausland/kolumbien-wie-gangs-waehrend-der-corona-pandemie-kinder-zwangsrekrutieren-a-4fec5337-e329-4497-9054-3df2001cfd8e";"news";"Wie Gangs in der Pandemie Kinder zwangsrekrutieren";"Wegen der Anti-Corona-Maßnahmen fällt in Kolumbien für viele Kinder der Schutzraum Schule weg. Paramilitärs oder Drogenbanden nutzen das aus - und ködern oder zwangsrekrutieren die Heranwachsenden für ihren Kampf.";"Guerilla, Paramilitärs, Drogenkartelle in Kolumbien";2020-07-12 17:17:32;"default";FALSE;"no223_news_free_2020-07-12H17-17-32.png"
"https://www.spiegel.de/wissenschaft/mensch/union-kontert-umweltgutachten-eine-unbequeme-wahrheit-a-5890ec55-8b1a-4e16-879f-6ac37a403e4d";"opinion";"Eine unbequeme Wahrheit";"Die Unionsfraktion positioniert sich wieder einmal klar gegen Wissenschaft und Klimaschutz. Besonders enthüllend ist dabei ihre jüngste Pressemitteilung zum Jahresgutachten des Umweltrates.";"Unionsfraktion kontert Umweltgutachten";2020-05-18 15:16:03;"default";FALSE;"no224_opinion_free_2020-05-18H15-16-03.png"
"https://www.spiegel.de/stil/zeiss-photography-award-paralleluniversen-a-3a1e7c58-5118-485b-bbc9-f773e8880464";"highlight";"Paralleluniversen";"Einsame, Fischer, Berge, Pflanzen und Catcherinnen: Für die fünfte Ausgabe des Fotowettbewerbs der World Photography Organisation und Zeiss waren \"\"Entdeckungen\"\" gefragt. Das hier sind die Finalisten.";"Ausgezeichnete Bilder";2020-04-07 17:46:23;"default";FALSE;"no225_highlight_free_2020-04-07H17-46-23.png"
"https://www.spiegel.de/wirtschaft/soziales/kohleausstieg-zuviel-kohle-fuer-zu-wenig-kohleausstieg-kommentar-a-f83505b9-6bae-4315-bce5-3e2146a22900";"opinion";"Zu viel Kohle für zu wenig Ausstieg";"Der Bundestag hat das Ende der Kohleverstromung besiegelt. Die Große Koalition hat Widerstände mit vielen Milliarden Euro beseitigt. Sie hätte das Geld besser in die klimaneutrale Zukunft investiert.";"Milliarden für Kraftwerksbetreiber";2020-07-03 12:45:00;"default";FALSE;"no226_opinion_free_2020-07-03H12-45-00.png"
"https://www.manager-magazin.de/politik/deutschland/wirtschaftsminister-kuendigt-dutzende-staatsbeteiligungen-an-a-c338d954-3e14-427c-846e-2372ddd94d77";"news";"Wirtschaftsminister kündigt Dutzende Staatsbeteiligungen an";"Die Lufthansa wird voraussichtlich keine Ausnahme bleiben. Wirtschaftsminister Altmaier rechnet mit Dutzenden Firmen, bei denen der Staat einsteigen soll.";"Nach Einstieg bei der Lufthansa";2020-07-11 14:03:04;"default";FALSE;"no227_news_free_2020-07-11H14-03-04.png"
"https://www.spiegel.de/deinspiegel/was-dich-in-dein-spiegel-nr-07-2020-erwartet-a-63f8ceaa-1e77-44f4-9993-c507837a029c";"highlight";"Was dich in \"\"Dein SPIEGEL\"\" Nr. 07/2020 erwartet";"Protest auf Abstand, Sound für den Sommer und Tiere, die du bestimmt noch nicht kennst – das sind die Themen der neuen Ausgabe von \"\"Dein SPIEGEL\"\".";"Blick ins Heft";2020-06-09 05:34:00;"default";FALSE;"no228_highlight_free_2020-06-09H05-34-00.png"
"https://www.spiegel.de/politik/deutschland/f-18-welchen-sinn-haben-deutsche-atombomber-a-63ccf36e-afb6-499e-97bc-c33bc9360ec6";"opinion";"Welchen Sinn haben deutsche Atombomber?";"Einige der von Deutschland bestellten F-18-Kampfflieger sollen im Ernstfall US-amerikanische Atombomben abwerfen können. Ist dieser Bringdienst noch zeitgemäß?";"Debatte über nukleare Teilhabe";2020-04-30 13:25:35;"default";FALSE;"no229_opinion_free_2020-04-30H13-25-35.png"
"https://www.spiegel.de/netzwelt/web/zoom-beugt-sich-chinas-zensur-wenigstens-eiert-zoom-nicht-herum-kommentar-a-ed725c70-620f-495c-892d-0517f1cde9c6";"opinion";"Wenigstens eiert Zoom nicht herum";"Zoom steht unter politischem Druck und stellt klar: Wir halten uns an lokale Gesetze - auch wenn das Sympathien kostet. Anders als andere Techkonzerne hat Zoom zumindest nie offensiv behauptet, die Welt verbessern zu wollen.";"Videochatdienst beugt sich Chinas Zensur";2020-06-12 12:24:07;"default";FALSE;"no230_opinion_free_2020-06-12H12-24-07.png"
"https://www.spiegel.de/kultur/paritaetsgesetz-in-brandenburg-so-feministisch-wie-angela-merkel-kolumne-a-3a967af5-4c2d-43c1-a78d-fe83c48e17ff";"opinion";"So feministisch wie Merkel";"In Brandenburg gilt ab heute, dass gleich viele Frauen wie Männer in den Landtag einziehen sollen. Ein großer Schritt für das Parlament - aber nur ein kleiner in Richtung echter Gleichberechtigung.";"Paritätsgesetz";2020-06-30 11:30:57;"default";FALSE;"no231_opinion_free_2020-06-30H11-30-57.png"
"https://www.spiegel.de/familie/tattoos-warum-catharina-die-handschrift-ihres-vaters-auf-der-haut-traegt-a-35326048-1f21-4868-9863-00b79a68fbff";"highlight";"Warum Catharina die Handschrift ihres Vaters auf der Haut trägt";"Wenn Catharina auf ihren Unterarm schaut, muss sie an ihren Vater denken - und daran, dass sie noch viele Fragen an ihn hat. Hier erzählt sie, was ihr Tattoo bedeutet.";"Die Geschichte eines Tattoos";2020-06-07 16:25:17;"default";FALSE;"no232_highlight_free_2020-06-07H16-25-17.png"
"https://www.spiegel.de/karriere/foto-quiz-erkennen-sie-diese-buerodinge-a-37135a84-74dd-4612-beb8-91f4e327a80b";"news";"Erkennen Sie diese Bürodinge?";"Nach Wochen im Homeoffice hat man schon fast vergessen, wie es im Büro war. Wenn Sie einen Schreibtischjob haben, sollten Sie diese Alltagsgegenstände kennen - aber wissen Sie wirklich, um was es sich handelt?";"Foto-Quiz";2020-07-13 06:26:13;"default";FALSE;"no233_news_free_2020-07-13H06-26-13.png"
"https://www.spiegel.de/deinspiegel/fynn-kliemann-im-dein-spiegel-interview-ich-kann-gar-nicht-gut-handwerkern-a-00000000-0002-0001-0000-000170766556";"highlight";"\"\"Ich kann gar nicht gut handwerkern\"\"";"Fynn Kliemann ist YouTuber, Musiker und selbst ernannter Heimwerkerking. Mit den Kinderreportern Neo, 9, und Nia, 13, sprach er über das Leben auf dem Land - und darüber, dass \"\"Kann ich nicht\"\" eine billige Ausrede ist.";"Fynn Kliemann im Kinder-Interview";2020-05-24 15:29:26;"default";FALSE;"no234_highlight_free_2020-05-24H15-29-26.png"
"https://www.spiegel.de/panorama/justiz/rosenheim-geldstrafe-und-freispruch-fuer-bundespolizisten-a-1f95060e-8f27-4e0b-bc90-2f3c6c1653d3";"news";"Hitlergruß - ein Freispruch und einmal Geldstrafe";"In Rosenheim mussten sich zwei Polizisten wegen ausländerfeindlicher Äußerungen an einem Kneipenabend vor Gericht verantworten. Nun ist das Urteil gefallen.";"Urteil gegen Bundespolizisten";2020-07-10 14:33:00;"default";FALSE;"no235_news_free_2020-07-10H14-33-00.png"
"https://www.spiegel.de/wirtschaft/soziales/coronavirus-millionaere-fordern-hoehere-steuern-fuer-sich-selbst-a-e68b917d-31b2-4b8c-bc16-2a63d31fa99e";"news";"Millionäre fordern höhere Steuern - für sich selbst";"Dauerhaft mehr Steuern für Millionäre - das fordern 83 Millionäre aus sieben Ländern, um die Gesellschaft nach der Corona-Pandemie wiederaufzubauen. Darunter sind auch fünf Deutsche.";"Für Wiederaufbau nach Corona";2020-07-13 10:55:35;"default";FALSE;"no236_news_free_2020-07-13H10-55-35.png"
"https://www.spiegel.de/stil/rezept-fuer-marokkanisches-zitronenhaehnchen-a-cec06f32-197c-4668-a379-99bc7db157d3";"highlight";"Am Wochenende gibt es marokkanisches Zitronenhähnchen";"Wann werden wir wieder nach Marrakesch fahren können? Mit diesem Rezept schickt unsere Köchin Verena Lugert zumindest schon mal Ihre Geschmacksnerven auf die Reise.";"Nervennahrung";2020-06-13 10:13:46;"default";FALSE;"no237_highlight_free_2020-06-13H10-13-46.png"
"https://www.spiegel.de/politik/ausland/europaeische-verteidigung-geschwister-wehrt-euch-gemeinsam-a-33667d42-0eee-496a-9a1c-e144567e7a66";"opinion";"Geschwister, wehrt euch gemeinsam!";"Donald Trump will Truppen aus Deutschland nach Polen verlegen - von diesem Manöver sollten sich die Europäer nicht spalten lassen. Hilfreich wäre im Gegenteil ein Signal der gemeinsamen Stärke im Osten der EU.";"Europäische Verteidigung";2020-06-27 10:45:34;"default";FALSE;"no238_opinion_free_2020-06-27H10-45-34.png"
"https://www.spiegel.de/deinspiegel/der-grosse-comic-wettbewerb-von-dein-spiegel-a-00000000-0002-0001-0000-000170766555";"highlight";"Der große Comic-Wettbewerb für Kinder";"Reporterhund Ferdinand erlebt die tollsten Geschichten, lesen kannst du sie in \"\"Dein SPIEGEL\"\". Jetzt bist du dran: Zeichne deinen eigenen Ferdinand-Comic, und gewinne tolle Preise!";"Zum Mitmachen";2020-05-15 13:11:23;"default";FALSE;"no239_highlight_free_2020-05-15H13-11-23.png"
"https://www.spiegel.de/psychologie/hilfe-bei-angststoerungen-drei-menschen-erzaehlen-was-ihnen-geholfen-hat-a-de2fa429-3d9a-4472-a3d8-cf0fc58aaf2a";"highlight";"\"\"Es ist okay, nicht jeden Tag zu funktionieren\"\"";"Viele Menschen leiden an Panikattacken - wenige reden darüber. Hier berichten drei Menschen von Schlüsselmomenten, die ihnen geholfen haben.";"Wege aus der Angststörung";2020-05-28 12:05:56;"default";FALSE;"no240_highlight_free_2020-05-28H12-05-56.png"
"https://www.spiegel.de/politik/ausland/indigene-transgender-in-kolumbien-zuflucht-zwischen-regenwald-und-kaffeepflanzen-a-06cfa8b9-2747-46ce-a06f-9b299c18b150";"news";"Zuflucht zwischen Regenwald und Kaffeepflanzen";"Viele indigene Transfrauen werden aus ihren Dorfgemeinschaften vertrieben. Auf den Kaffeefeldern in den Bergen von Risaralda treffen sie sich und fühlen sich frei. Eine deutsche Fotografin hat sie begleitet.";"Indigene Transfrauen in Kolumbien";2020-07-11 17:55:06;"default";FALSE;"no241_news_free_2020-07-11H17-55-06.png"
"https://www.spiegel.de/politik/deutschland/fleischindustrie-billig-ist-nicht-boese-kolumne-a-9e513549-d37a-43b1-9ee9-75f3de7559d1";"opinion";"Billig ist nicht böse";"Nach den Corona-Ausbrüchen in Fleischfabriken wird \"\"billig\"\" zum neuen Schimpfwort. Dahinter stecken ökonomische Unkenntnis oder sinistre Erziehungsfantasien.";"Fleischindustrie";2020-06-22 12:51:00;"default";FALSE;"no242_opinion_free_2020-06-22H12-51-00.png"
"https://www.spiegel.de/panorama/salzburg-13-jaehriger-stirbt-an-eishoehle-eisriesenwelt-nach-steinschlag-a-f9d4ed4b-c18c-4b49-90fe-f39e345bf565";"news";"Junge stirbt bei Wanderung nach Steinschlag";"Ein 13-Jähriger ist an der beliebten Eisriesenwelt in der Nähe von Salzburg von herabstürzenden Felsbrocken so schwer verletzt worden, dass er ums Leben kam. Ein weiterer Jugendlicher wurde verletzt.";"Werfen bei Salzburg";2020-07-12 13:46:00;"default";FALSE;"no243_news_free_2020-07-12H13-46-00.png"
"https://www.spiegel.de/stil/rezept-fuer-blumenkohlgratin-a-63064c59-b064-4efd-a2f1-c26f50dcb988";"highlight";"Heute gibt es Blumenkohlgratin";"Die Kita hat zu, die Kantine ist geschlossen. Da hilft nur eins: selbst kochen. Aber bitte schnell und einfach. Die Köchin Verena Lugert zeigt, wie es geht.";"Nervennahrung";2020-04-16 09:02:01;"default";FALSE;"no244_highlight_free_2020-04-16H09-02-01.png"
"https://www.spiegel.de/stil/schwetzinger-schlossgarten-rasen-als-kunst-a-0cbe0567-0173-4342-9c73-eadf1050e478";"highlight";"Kunst-Rasen";"Wie historische Gärten vor dem Klimawandel gerettet und warum Lärchen statt Pappeln gepflanzt werden: ein Spaziergang durch den Schwetzinger Schlossgarten mit dem Gartenexperten Hartmut Troll.";"Der Wurm drin - die Gartenkolumne";2020-07-12 11:32:26;"default";FALSE;"no245_highlight_free_2020-07-12H11-32-26.png"
"https://www.spiegel.de/kultur/antwort-auf-offenen-brief-zur-diskurskultur-nur-ein-versuch-die-debatte-zu-kontrollieren-a-ab1e9f71-0f3a-4f63-9268-79dbd440afa2";"news";"\"\"Der Versuch, eine andauernde Debatte zu kontrollieren\"\"";"J.K. Rowling, Daniel Kehlmann und andere Intellektuelle fürchten ein intolerantes Debattenklima. Nicht ganz so prominente Stimmen antworten nun auf ihren offenen Brief. Der Vorwurf: Es gehe ihnen um die Verteidigung von Macht.";"Antwort auf offenen Brief zur Diskurskultur";2020-07-10 17:38:29;"default";FALSE;"no246_news_free_2020-07-10H17-38-29.png"
"https://www.spiegel.de/stil/schuhe-aus-huehnerleder-gockel-statt-kroko-a-0d689104-5f43-45d6-8d15-d5d2ed94a76a";"highlight";"Gockel statt Kroko";"Man muss schon sehr genau hinsehen, um Gemeinsamkeiten zwischen Hühnern und Krokodilen zu erkennen: Doch ihre Haut ähnelt sich. Ein findiger Unternehmer aus Indonesien macht sich das zunutze.";"Schuhe aus Hühnerleder";2020-04-12 20:38:07;"default";FALSE;"no247_highlight_free_2020-04-12H20-38-07.png"
"https://www.spiegel.de/politik/ausland/usa-donald-trump-soll-verkauf-von-puerto-rico-vorgeschlagen-haben-a-0eb22056-c74f-49c2-8e63-9a3b4c417bd4";"news";"Trump soll Verkauf von Puerto Rico vorgeschlagen haben";"Hurrikan \"\"Maria\"\" richtete 2017 große Schäden in Puerto Rico an, fast 3000 Menschen starben. US-Präsident Trump reagierte zunächst wie ein Geschäftsmann, erinnert sich die damalige Heimatschutzministerin.";"Nach Verwüstungen durch Hurrikan";2020-07-13 06:07:33;"default";FALSE;"no248_news_free_2020-07-13H06-07-33.png"
"https://www.spiegel.de/familie/rassismus-in-deutschland-wie-people-of-color-ihre-kinder-darauf-vorbereiten-a-e22cff3c-0138-4c5a-a18d-f264c23464a9";"highlight";"\"\"Kinder haben eigentlich ein sehr gutes Gefühl für Ungerechtigkeit\"\"";"Rassismus verletzt. Wie können Eltern ihre Kinder davor schützen? Wann sprechen sie an, dass ihre  Hautfarbe ein Nachteil sein kann? Hier erzählen fünf nicht weiße Mütter und Väter.";"Wie Eltern ihre Kinder auf Rassismus vorbereiten";2020-06-12 13:04:06;"default";FALSE;"no249_highlight_free_2020-06-12H13-04-06.png"
"https://www.spiegel.de/kultur/wer-hat-angst-vor-dem-genderwahn-kommentar-von-liane-bednarz-a-948ed8f6-fa1f-465c-9b07-86cfcf34ccb0";"opinion";"Wer hat Angst vor dem \"\"Genderwahn\"\"?";"Die Themen \"\"Gendersprache\"\" und \"\"Gender\"\" sind Daueraufreger unter Konservativen, wie die Reaktionen etwa auf die Sprachpraxis von Anne Will erneut verdeutlichten. Dabei wird oft maßlos übertrieben. Zeit für etwas Gelassenheit.";"Geschlechtergerechte Sprache";2020-06-05 17:08:49;"default";FALSE;"no250_opinion_free_2020-06-05H17-08-49.png"
"https://www.spiegel.de/deinspiegel/was-dich-im-sommerheft-von-dein-spiegel-erwartet-a-d5c747bc-ad8f-480a-92bd-edb076b53d39";"highlight";"Was dich im Sommerheft von \"\"Dein SPIEGEL\"\" erwartet";"33 Ideen für den Sommer, eine Skateboard-Legende im Interview und faszinierende Quallen – das sind die Themen der neuen Ausgabe von \"\"Dein SPIEGEL\"\".";"Blick ins Heft";2020-07-01 10:38:44;"default";FALSE;"no251_highlight_free_2020-07-01H10-38-44.png"
"https://www.spiegel.de/sport/basketball/craig-hodges-der-colin-kaepernick-der-nba-nur-25-jahre-frueher-a-c42edd7a-c0e3-4b6d-b575-eaa17d3a351e";"news";"Der Spieler, der nicht schweigen wollte";"Bei den Chicago Bulls spielte er neben Michael Jordan, doch anders als der Superstar erhob Craig Hodges schon damals seine Stimme gegen den Rassismus in den USA. Es kostete ihn die Karriere.";"NBA-Star Craig Hodges";2020-07-11 09:49:51;"default";FALSE;"no252_news_free_2020-07-11H09-49-51.png"
"https://www.spiegel.de/politik/deutschland/afd-konflikt-um-andreas-kalbitz-kein-richtungsstreit-nur-eine-farce-a-16cb7139-f423-442b-bab5-1ff7f67e9fcd";"opinion";"Kein Richtungsstreit, nur eine Farce";"Wäre die AfD so bürgerlich, wie sie tut, dann würde sie gar nicht erst darüber streiten, ob sie den Rechtsextremisten Andreas Kalbitz ausschließen sollte. Es wäre selbstverständlich.";"AfD-Konflikt um Kalbitz";2020-07-05 14:24:00;"default";FALSE;"no253_opinion_free_2020-07-05H14-24-00.png"
"https://www.spiegel.de/reise/deutschland/wandern-im-schwarzwald-einfach-losstiefeln-a-ab988582-a063-4024-bb0b-bd3b230a2af1";"highlight";"Einfach losstiefeln";"Zwei Mehrtagestouren im Schwarzwald machen Lust aufs Rucksackpacken. Jetzt müssen Sie sich nur noch entscheiden: Suchen Sie das kleine oder das große Abenteuer?";"Wandern im Schwarzwald";2020-06-10 05:37:14;"default";FALSE;"no254_highlight_free_2020-06-10H05-37-14.png"
"https://www.spiegel.de/stil/s-magazin/oda-jaune-im-gezeichneten-interview-was-wollten-sie-als-kind-werden-a-00000000-0002-0001-0000-000170854061";"highlight";"Frau Jaune, was bedeutet für Sie zu Hause?";"Die Bilder der Künstlerin Oda Jaune sind schön und verstörend zugleich - selbst wenn sie nur ihr Frühstück malt. Für unser Interview fertigte sie neun Aquarelle an.";"Das gezeichnete Interview";2020-06-21 05:54:12;"default";FALSE;"no255_highlight_free_2020-06-21H05-54-12.png"
"https://www.spiegel.de/politik/ausland/israels-annexionsplaene-die-palaestinenser-sind-auch-selbst-schuld-kommentar-a-beb46e54-f72e-4907-ac6e-6c4885abfab1";"opinion";"Die Palästinenser sind auch selbst schuld";"Für die Folgen einer Teil-Annexion des Westjordanlands trägt die israelische Regierung die Verantwortung. Aber für den Verlust eines Teils ihres möglichen Staatsgebiets sollten die Palästinenser ihre eigene Führung zur Rechenschaft ziehen.";"Israels Annexionspläne";2020-06-11 14:36:25;"default";FALSE;"no256_opinion_free_2020-06-11H14-36-25.png"
"https://www.spiegel.de/familie/midlife-probleme-die-tief-empfundene-erkenntnis-dass-verschwendete-tage-nicht-nachholbar-sind-a-aeb5964a-9df1-4374-8fdf-4752bf8b1278";"opinion";"Die tief empfundene Erkenntnis, dass verschwendete Tage nicht nachholbar sind";"Gibt es eine Moral von der Geschicht' von der Seuche, die uns zu Stubenhockern macht? Aber ja, meint Frank Patalong - und hofft, dass die Seuche sie uns ins Hirn tätowiert.";"Alter! - Die Midlife-Kolumne";2020-05-05 13:49:55;"default";FALSE;"no257_opinion_free_2020-05-05H13-49-55.png"
"https://prod.www.manager-magazin.de/finanzen/artikel/bank-fuer-internationalen-zahlungsausgleich-die-inflation-kommt-zurueck-a-1308103.html";"opinion";"Warum die Bank für Internationalen Zahlungsausgleich vor Inflation warnt";"Die Bank für Internationalen Zahlungsausgleich warnt im Annual Economic Report vor einer epochalen Trendwende: Nachdem sie seit vierzig Jahren rückläufig war, droht eine Phase (deutlich) höherer Inflation. Denn die Notenbanken, die sich dem entgegenstellen sollten, werden es nicht tun.";"Real- und Nominalzinsen driften auseinander";2020-06-30 12:15:00;"default";FALSE;"no258_opinion_free_2020-06-30H12-15-00.png"
"https://www.spiegel.de/politik/ausland/straferlass-fuer-roger-stone-der-beste-mann-von-donald-trump-a-8d09faf6-ece8-4765-9701-57c9da18f79a";"news";"Trumps bester Mann";"US-Präsident Trump nutzt seine Macht und bewahrt den alten Weggefährten Roger Stone vor einem Gefängnisaufenthalt. Die Empörung in Washington ist groß. Wird er für sein Schweigen belohnt?";"Straferlass für Roger Stone";2020-07-11 15:55:20;"default";FALSE;"no259_news_free_2020-07-11H15-55-20.png"
"https://www.spiegel.de/panorama/leute/juergen-klopp-trainer-des-fc-liverpool-will-nach-seinem-karriereende-zurueck-nach-deutschland-a-5c9286fa-997a-477f-affc-215c14ee7e60";"news";"\"\"Wenn man aus dem Schwarzwald kommt, dann lebt man nicht in einer WG\"\"";"Jürgen Klopp wohnt in Liverpool in einer Männer-WG, offenbar eine ungewohnte Situation für den 53-Jährigen. In einem Interview spricht er über Arbeitsteilung - und Zukunftspläne in Deutschland.";"Liverpool-Trainer Jürgen Klopp";2020-07-13 08:32:09;"default";FALSE;"no260_news_free_2020-07-13H08-32-09.png"
"https://www.spiegel.de/politik/ausland/polen-andrzej-duda-als-praesident-wiedergewaehlt-die-eminenz-im-schatten-a-e36093fd-c6ca-4345-9910-bb0659ffbb27";"news";"Die Eminenz im Schatten";"Die Wiederwahl von Andrzej Duda stärkt die autoritäre Herrschaft der Nationalkonservativen in Polen. Parteichef Jaroslaw Kaczynski kann die Demokratie weiter zurückbauen.";"Präsidentenwahl in Polen";2020-07-13 09:15:59;"default";FALSE;"no261_news_free_2020-07-13H09-15-59.png"
