"ArticleUrl";"Type";"Title";"Intro";"Heading";"PublishDate";"Style";"IsPlus";"filename"
"https://www.spiegel.de/panorama/nsu-2-0-hessischer-sonderermittler-soll-drohmails-untersuchen-a-ab078c57-d804-4e39-bbfa-878d1cd5b096";"news";"Sonderermittler soll Mails vom \"\"NSU 2.0\"\" untersuchen";"Seit Jahren drohen Unbekannte immer wieder im Namen des \"\"NSU 2.0\"\", zuletzt traf es Linkenpolitikerin Janine Wissler. Nun reagiert das hessische Innenministerium - nach Einschätzung von Kritikern viel zu spät.";"Todesdrohungen";2020-07-10 13:48:02;"default";FALSE;"no368_news_free_2020-07-10H13-48-02.png"
"https://www.spiegel.de/panorama/justiz/stuttgart-polizei-plant-stammbaumforschung-zu-tatverdaechtigen-kritik-aus-der-politik-a-c84537a9-74b5-484c-8393-19c6239c50e0";"news";"Stammbaumforschung zu Tatverdächtigen? Bartsch spricht von \"\"Rassismus pur\"\"";"Bei den Ermittlungen zu den Vorfällen in Stuttgart will die Polizei laut einem Bericht die Stammbäume der Tatverdächtigen prüfen. Politiker kritisieren das Vorgehen scharf. Polizei und Stadt dementieren die Meldung.";"Ausschreitungen in Stuttgart";2020-07-12 13:38:48;"default";FALSE;"no369_news_free_2020-07-12H13-38-48.png"
"https://www.spiegel.de/stil/einmal-mit-alles-cihan-anadologlus-doenerbibel-a-9dbc0bdf-f9f2-44c9-a41d-323f049f8726";"highlight";"Döner heb' ab!";"Sie mögen Döner? Dann werden sie dieses Buch verschlingen. Der Barmann Cihan Anadologlu mixt Kebabfleisch mit Mango oder Rotwein. Klingt komisch, schmeckt aber so viel besser als \"\"einmal mit alles\"\".";"Kebab-Kochbuch";2020-05-24 07:56:29;"default";FALSE;"no370_highlight_free_2020-05-24H07-56-29.png"
"https://www.spiegel.de/wissenschaft/medizin/coronavirus-deutschlands-diskussion-ueber-die-maske-a-56c2e31a-bbaa-4b98-9b59-f7caa56bfc26";"opinion";"Riskante Sehnsucht nach oben ohne";"Deutschlands Diskussionen über die Maskenpflicht; in weiten Teilen Amerikas breitet sich das Coronavirus gefährlich aus sowie die neuesten Forschungsergebnisse: Lesen Sie hier Ihren Wochenüberblick.";"Coronavirus - die Woche";2020-07-10 15:26:43;"default";FALSE;"no371_opinion_free_2020-07-10H15-26-43.png"
"https://www.spiegel.de/politik/deutschland/donald-trumps-truppenabzugsplan-der-entbuendete-im-weissen-haus-a-37378db9-0395-4309-a2d7-8f1ecc07a20d";"opinion";"Der Entbündete im Weißen Haus";"US-Präsident Trump belastet mit dem Plan, Tausende Soldaten aus Deutschland abzuziehen, nicht nur die Beziehungen zu Deutschland schwer. Das transatlantische Bündnis selbst droht ins Wanken zu geraten.";"US-Truppenabzug";2020-06-08 18:58:47;"default";FALSE;"no372_opinion_free_2020-06-08H18-58-47.png"
"https://www.spiegel.de/kultur/usa-bewaffnetes-paar-in-st-louis-mit-dem-ruecken-zur-wand-a-e441ba45-f170-401c-a400-2b3a69b52f90";"opinion";"Mit dem Rücken zur Wand";"Die Bilder aus St. Louis wirken auf den ersten Blick wie aus einer Komödie: Ein bürgerliches Paar verteidigt seine Villa. Für Trump und manche seiner Anhänger aber könnte es ein Zeichen sein - fürs letzte Gefecht.";"Bewaffnetes US-Paar in St. Louis";2020-06-30 18:31:19;"default";FALSE;"no373_opinion_free_2020-06-30H18-31-19.png"
"https://www.manager-magazin.de/harvard/fuehrung/homeoffice-diese-faktoren-schaden-der-motivation-a-f86b1ac6-cce8-4ab4-bdb8-be99f4da023c";"opinion";"Diese drei Faktoren senken die Motivation im Homeoffice";"Warum sind wir im Büro produktiver als am heimischen Schreibtisch? Eine Studie hat drei Gründe dafür ausgemacht. Und herausgefunden, was dagegen hilft.";"Newsletter Lead Forward";2020-07-07 05:58:56;"default";FALSE;"no374_opinion_free_2020-07-07H05-58-56.png"
"https://www.spiegel.de/politik/deutschland/warum-deutschland-keinen-tag-der-befreiung-feiern-sollte-kommentar-a-00000000-0002-0001-0000-000170716160";"opinion";"Warum Deutschland keinen \"\"Tag der Befreiung\"\" feiern sollte";"Eine Mehrheit der Deutschen nimmt den Begriff \"\"Befreiung\"\" inzwischen wörtlich: Es seien nur einige Verbrecher gewesen, die den Zweiten Weltkrieg angezettelt und die Juden ermordet haben.";"75 Jahre nach Kriegsende";2020-05-01 16:00:00;"default";FALSE;"no375_opinion_free_2020-05-01H16-00-00.png"
"https://www.spiegel.de/netzwelt/gadgets/panoramen-zusammenfuegen-tipps-fuer-lightroom-photoshop-und-affinity-photo-a-9fe1f9cc-5ac9-4d71-88b7-7f406f34c212";"news";"So fügen Sie Einzelbilder zu Panoramen zusammen";"Lightroom, Photoshop und Affinity Photo besitzen leistungsfähige Module, um aus mehreren Bildern Panoramen zu erzeugen. Das Fotomagazin \"\"Docma\"\" erklärt, wie man dabei vorgehen sollte.";"Foto-Tipps";2020-07-11 13:59:33;"default";FALSE;"no376_news_free_2020-07-11H13-59-33.png"
"https://www.spiegel.de/familie/umgang-mit-rassistischem-denken-rassismus-ist-ein-bisschen-wie-smog-den-wir-einatmen-a-8fff674a-80dc-45ed-935b-290c24f127d0";"highlight";"\"\"Rassismus ist ein bisschen wie Smog, den wir täglich einatmen\"\"";"Wir alle wurden rassistisch sozialisiert, sagt Tupoka Ogette. Im Interview erklärt sie, wie wir das verändern können - und warum es wichtig ist, schon mit Kindern über Rassismus zu sprechen.";"Antirassismus-Trainerin";2020-06-14 07:58:42;"default";FALSE;"no377_highlight_free_2020-06-14H07-58-42.png"
"https://www.spiegel.de/sport/fussball/zweitliga-relegation-1-fc-nuernberg-rettet-klassenerhalt-in-der-nachspielzeit-a-61482c87-a38c-459f-8bf2-3ae96c4432d0";"news";"Nürnberg verhindert den Super-Gaus";"Mit zwei Toren führte der 1. FC Nürnberg nach dem Hinspiel der Zweitliga-Relegation. Im Rückspiel bereitete Ingolstadts Marcel Gaus drei Tore mit Freistößen vor - doch Nürnberg rettet sich in der Nachspielzeit.";"Rettung in der Relegation";2020-07-11 18:13:00;"default";FALSE;"no378_news_free_2020-07-11H18-13-00.png"
"https://www.spiegel.de/kultur/ausstellung-von-otobong-nkanga-in-berlin-an-der-wurzel-gepackt-a-16ac7df3-a786-4f2d-b78e-59c08d4bdfe5";"news";"An der Wurzel gepackt";"Die Ausbeutung globaler Ressourcen erschöpft Mensch und Planet. Doch was braucht es für ein gesundes Zusammenleben? In Berlin findet die Künstlerin Otobong Nkanga Antworten in Pflanzen und Erdböden.";"Ausstellung in Berlin";2020-07-12 17:11:18;"default";FALSE;"no379_news_free_2020-07-12H17-11-18.png"
"https://www.spiegel.de/panorama/oberhausen-rheinhausen-camping-bus-rollt-unbemerkt-in-den-rhein-junge-frau-stirbt-a-43de6e91-3463-4eee-bab6-9150dfb27840";"news";"Campingbus rollt in den Rhein - junge Frau stirbt";"Einsatzkräfte haben in der Nacht zu Samstag einen Bus aus dem Rhein geborgen. Der Wagen war wohl unbemerkt in den Fluss gerutscht. Für eine 22-Jährige kam die Hilfe zu spät.";"Baden-Württemberg";2020-07-11 12:09:00;"default";FALSE;"no380_news_free_2020-07-11H12-09-00.png"
"https://www.spiegel.de/politik/ausland/gefaehrdete-demokratie-in-usa-die-erschoepfte-nation-a-f41cc08b-53ad-4f8c-ab0c-d1857f8d9025";"opinion";"Die erschöpfte Nation";"Bei den Unruhen in den USA geht es nicht allein um Protest gegen Rassismus. Trumps Präsidentschaft droht zur Gefahr für die amerikanische Demokratie zu werden. Findet sie noch die Kraft, sich zu erneuern?";"US-Demokratie in der Krise";2020-06-05 11:53:00;"default";FALSE;"no381_opinion_free_2020-06-05H11-53-00.png"
"https://www.spiegel.de/sport/formel1/formel-1-rennstall-racing-point-fia-beschlagnahmt-teile-a-ac3a7377-f68e-4cc4-bead-83abddea94c1";"news";"Zu gut, um legal zu sein?";"In der neuen Formel-1-Saison überrascht Racing Point. Fast eine Sekunde schneller ist das Team als im Vorjahr. Das ruft Zweifler hervor, die Fia beschlagnahmte nun Teile der Boliden.";"Untersuchungen bei Formel-1-Rennstall Racing Point";2020-07-13 06:30:00;"default";FALSE;"no382_news_free_2020-07-13H06-30-00.png"
"https://www.spiegel.de/panorama/gesellschaft/daenemark-urlaub-ich-wuerde-euch-gern-in-den-arm-nehmen-a-c827bd5b-aa78-4ec1-8b99-0c4e3aa0a781";"opinion";"\"\"Ich würde Euch gern in den Arm nehmen\"\"";"Auf seinen Brandbrief an die Dänen hat unser Autor jede Menge Post bekommen. Hier antwortet der verhinderte Urlauber - Zeit dafür hat er genug. Denn die Reise ist endgültig abgesagt.";"Geplatzter Dänemark-Urlaub";2020-05-15 19:31:00;"default";FALSE;"no383_opinion_free_2020-05-15H19-31-00.png"
"https://www.spiegel.de/reise/eremit-ueber-das-alleinsein-das-ist-ein-existenzieller-schock-a-dd21ae62-3ef8-43b5-834a-0c78bfe47776";"highlight";"\"\"Das ist ein existenzieller Schock\"\"";"Viele Alleinlebende haben Schwierigkeiten mit den zurzeit verordneten Kontaktbeschränkungen. Für den katholischen Pater Jürgen Knobel ist die Isolation Beruf: Er ist Eremit. Was können wir von ihm lernen?";"Eremit über das Alleinsein";2020-04-13 18:53:12;"default";FALSE;"no384_highlight_free_2020-04-13H18-53-12.png"
"https://www.spiegel.de/netzwelt/web/privatisierung-von-sicherheitsbehoerden-ein-duesterer-digitaltraum-a-ad4d4aaa-4901-463f-bce4-6218808d8477";"opinion";"Ein düsterer Digitaltraum";"Die Affäre um Philipp Amthor wirft  Licht auf gefährliche Bestrebungen zur Privatisierung von Sicherheit und Überwachung. Denn was privat ist, unterliegt kaum demokratischen Kontrollinstanzen.";"Philipp Amthor";2020-06-17 16:57:34;"default";FALSE;"no385_opinion_free_2020-06-17H16-57-34.png"
"https://www.spiegel.de/panorama/justiz/muenchen-rabbiner-verfolgt-und-antisemitisch-beleidigt-a-9c1aa69e-1fe5-4ad3-9709-e31d1c338fa1";"news";"Rabbiner in München verfolgt und antisemitisch beleidigt";"Ein Rabbiner ist am Donnerstag von vier Männern nach Verlassen einer Straßenbahn verfolgt worden, sie hätten sich wiederholt abfällig über den Staat Israel geäußert. Die Fahndung verlief zunächst erfolglos.";"Polizei sucht Zeugen";2020-07-11 20:32:52;"default";FALSE;"no386_news_free_2020-07-11H20-32-52.png"
"https://www.spiegel.de/reise/fernweh/naturfotograf-art-wolfe-ueber-das-reisen-ich-suche-das-schoene-in-allem-a-daf03481-ac69-4f4d-a0b4-ca6e4d6e408b";"highlight";"\"\"Ich suche das Schöne in allem\"\"";"Neugierde trifft auf Natur: Der Fotograf Art Wolfe spricht über das perfekte Bild, den Angriff eines Panzernashorns - und erklärt, warum man für ein gutes Foto keine teure Kamera braucht.";"Tipps von Naturfotograf Art Wolfe";2020-05-26 20:38:07;"default";FALSE;"no387_highlight_free_2020-05-26H20-38-07.png"
"https://www.spiegel.de/reise/wandern-in-den-alpen-warum-es-gut-tut-allein-in-die-berge-zu-ziehen-a-603d94b0-f6b8-486c-8567-0c7c41e33aae";"highlight";"Warum es guttut, allein in die Berge zu ziehen";"Der Ansturm auf die Alpen ist groß - dabei sollten auch auf den Bergpfaden Abstandsregeln gelten. Günter Kast ist daher nach langer Zeit mal wieder allein unterwegs und fragt sich: Ist das eine gute Idee?";"Alpentour";2020-07-13 03:53:46;"default";FALSE;"no388_highlight_free_2020-07-13H03-53-46.png"
"https://www.spiegel.de/politik/deutschland/saskia-esken-und-norbert-walter-borjans-spd-chefs-offen-fuer-kanzlerkandidatur-von-olaf-scholz-a-a7143d58-4f50-4080-a5e4-7b1ca470afba";"news";"SPD-Chefs offen für Kanzlerkandidatur von Olaf Scholz";"Man arbeite \"\"zunehmend eng und vertrauensvoll zusammen\"\", sagt Parteichefin Esken über Olaf Scholz. Der Finanzminister kann sich Hoffnungen auf die Spitzenkandidatur der SPD machen.";"Bundestagswahl 2021";2020-07-13 10:18:47;"default";FALSE;"no389_news_free_2020-07-13H10-18-47.png"
"https://www.spiegel.de/politik/deutschland/syrien-ermittler-nehmen-zwei-mutmassliche-kriegsverbrecher-in-deutschland-fest-a-99fc7a30-05e8-4904-a726-70c736769a55";"news";"Ermittler nehmen zwei mutmaßliche Kriegsverbrecher aus Syrien fest";"Zwei Syrer sollen an der Hinrichtung eines Oberstleutnants der Regierungstruppen in ihrer Heimat beteiligt gewesen sein. Sie wurden nun in Deutschland festgenommen.";"In Sachsen-Anhalt und NRW";2020-07-13 09:38:54;"default";FALSE;"no390_news_free_2020-07-13H09-38-54.png"
"https://www.spiegel.de/wissenschaft/mensch/boogaloo-bewegung-hass-im-hawaiihemd-kolumne-a-38f0ef56-009c-4980-bd0f-abecac73151c";"opinion";"Hass im Hawaiihemd";"Unter die \"\"Black Lives Matter\"\"-Demonstranten in den USA mischen sich schwer bewaffnete Weiße in Hawaiihemden. Die bizarre Bewegung strebt einen Bürgerkrieg an - und hat den gleichen Geburtsort wie Anonymous.";"Boogaloo-Bewegung";2020-06-07 15:50:31;"default";FALSE;"no391_opinion_free_2020-06-07H15-50-31.png"
"https://www.spiegel.de/politik/deutschland/lobbyismus-endlich-licht-ins-hinterzimmer-a-897e5e8b-9c37-4f8d-8340-0e4968b32b30";"opinion";"Endlich Licht ins Hinterzimmer";"Lobbyismus ist nicht böse - er gehört zur Politik. Aber die Bürger sollten wissen, wer wen mit welchen Interessen berät. Nicht zuletzt der Fall Amthor zeigt: Die Zeit ist reif für gesetzlich garantierte Transparenz.";"Lobbyismus";2020-06-26 17:23:56;"default";FALSE;"no392_opinion_free_2020-06-26H17-23-56.png"
"https://www.spiegel.de/harvard/fuehrung/agiles-management-bei-sipgate-scrum-brachte-die-wende-a-00000000-0002-0001-0000-000158269954";"highlight";"\"\"Im besten Fall werde ich ignoriert\"\"";"Ein paar Jahre nach seiner Gründung geriet der Internettelefonie-Anbieter Sipgate in eine schwere Krise: Alles dauerte viel zu lange, die Produktivität ging gegen null. Das Führungsteam um Tim Mois war ratlos. Ein schmales Buch über Scrum brachte die Wende. Heute hat sich Sipgate komplett agil aufgestellt. Manager und Titel gibt es nicht mehr – dafür aber eine Stechuhr, damit keiner Überstunden macht.";"Tim Mois von Sipgate";2020-06-22 10:07:34;"default";FALSE;"no393_highlight_free_2020-06-22H10-07-34.png"
"https://www.manager-magazin.de/ueber-uns/mcdonald-s-wirecard-und-warren-buffet-das-war-montag-6-7-2020-a-eb88a656-53a6-4c64-8ba9-80128f7ad90e";"opinion";"Der Tag mit dem besten Geschäftsmodell der Welt";"Jeden Abend fassen wir die wichtigsten Wirtschaftsnews des Tages zusammen. Heute mit dem neuesten Deal von Warren Buffett, den geheimen Hintergründen des Wirecard-Skandals und den Zukunftstrends der Gastronomie.";"Newsletter \"\"Der Tag\"\"";2020-07-06 16:00:00;"default";FALSE;"no394_opinion_free_2020-07-06H16-00-00.png"
"https://www.spiegel.de/stil/wein-was-die-einzelnen-qualitaetsstufen-bedeuten-a-fc9885c8-514a-41fd-94e2-f6f983adc157";"highlight";"Viele Flaschen, aber kein Durchblick";"Deutsche Weinetiketten sind kompliziert. Manche nennen Kunstnamen, manche die Lage, andere nur die Rebsorte. Auch die Pflichtangaben helfen nicht. Die ersten Winzer haben reagiert - und die Konfusion noch vergrößert.";"Qualitätsstufen beim Wein";2020-05-10 13:46:51;"default";FALSE;"no395_highlight_free_2020-05-10H13-46-51.png"
"https://www.spiegel.de/stil/s-magazin/rote-bete-saft-mit-soba-cha-von-robin-pietsch-nuechtern-berauscht-a-00000000-0002-0001-0000-000170854057";"highlight";"Nüchtern berauscht";"Wer sagt, dass es immer Wein sein muss zur Haute Cuisine? Robin Pietsch serviert in seinen Restaurants Saftgänge zu Sternemenüs.";"Rote-Bete-Saft mit Soba-Cha";2020-06-24 19:05:00;"default";FALSE;"no396_highlight_free_2020-06-24H19-05-00.png"
"https://www.spiegel.de/karriere/1000-dollar-in-briefumschlaegen-verteilen-raetsel-der-woche-a-9f2d43f7-d623-4038-91af-a333ebf644cf";"news";"1000 Dollar in Briefumschlägen verteilen";"Verteilen Sie 1000 Ein-Dollar-Scheine über möglichst wenige Briefumschläge! Dabei soll jeder Betrag zwischen einem und 1000 Dollar durch eine Auswahl aus diesen Briefen darstellbar sein.";"Rätsel der Woche";2020-07-12 17:07:00;"default";FALSE;"no397_news_free_2020-07-12H17-07-00.png"
"https://www.spiegel.de/politik/deutschland/philipp-amthor-und-seine-geschaeftchen-ganz-alte-schule-kommentar-a-733f1ffd-d6c2-424c-a9b6-d1b6c1321c6f";"opinion";"Ganz alte Schule";"Im jungen Abgeordneten Philipp Amthor lebt eine längst verloren geglaubte Tradition der Union fort: die CDU als markiger Männerbund zum Zweck der Anhäufung von Kapital für die richtigen Leute.";"Philipp Amthors Geschäftchen";2020-06-15 17:00:09;"default";FALSE;"no398_opinion_free_2020-06-15H17-00-09.png"
"https://www.spiegel.de/deinspiegel/so-wirst-du-kinderreporter-a-b96f8d02-993d-4335-9ad2-ab7d19e971be";"highlight";"So wirst du Kinderreporter";"Kinderreporter treffen jede Menge interessante Leute aus Politik, Sport, und Wirtschaft oder Musik-, Film- und Internet-Stars. Wenn du Lust hast, für \"\"Dein SPIEGEL\"\" Fragen zu stellen, dann bewirb dich bei uns.";"Bewirb dich!";2020-07-11 08:18:59;"default";FALSE;"no399_highlight_free_2020-07-11H08-18-59.png"
"https://www.spiegel.de/panorama/justiz/todesstrafe-in-den-usa-hinrichtung-auf-bundesebene-soll-trotz-corona-krise-vollstreckt-werden-a-4fbffdd5-c741-4f69-a6f8-5e4da60b3998";"news";"USA wollen Hinrichtung auf Bundesebene vollstrecken";"Die Angehörigen seiner Opfer wollten die Vollstreckung der Todesstrafe verhindern: Ein Mörder in den USA soll trotz Coronakrise hingerichtet werden. Es wäre die erste Exekution auf Bundesebene nach 17 Jahren.";"Trotz Coronavirus-Pandemie";2020-07-13 05:57:00;"default";FALSE;"no400_news_free_2020-07-13H05-57-00.png"
"https://www.spiegel.de/panorama/ermittler-sehen-lawine-als-ursache-fuer-mysterioesen-tod-von-wanderern-a-0db25dd7-b160-49cc-a2f6-0b0dc385ae27";"news";"Ermittler sehen Lawine als Ursache für mysteriösen Tod von Wanderern";"1959 starben neun Skiwanderer unter merkwürdigen Umständen am Djatlow-Pass: Man fand sie in einem Wald nahe ihrem Lager, am Körper trugen sie nur Nachtwäsche. Nun ist der Fall angeblich aufgeklärt.";"Unglück in Russland";2020-07-11 16:58:26;"default";FALSE;"no401_news_free_2020-07-11H16-58-26.png"
"https://www.spiegel.de/wirtschaft/soziales/ezb-warum-das-bundesverfassungsgericht-urteil-die-eu-staerkt-nicht-schwaecht-a-b21ef607-57fd-4f73-bb46-4d99e91538a9";"opinion";"Warum das EZB-Urteil die EU stärkt, nicht schwächt";"Das Bundesverfassungsgericht hat die Anleihenkäufe der EZB beanstandet. Viele sehen in dem Urteil eine Gefahr für die Stabilität der EU - dabei wirkt der Richterspruch der Scharfmacherei rechter EU-Verächter entgegen.";"Bundesverfassungsgericht";2020-05-12 13:47:01;"default";FALSE;"no402_opinion_free_2020-05-12H13-47-01.png"
"https://www.spiegel.de/wirtschaft/unternehmen/coronavirus-ralf-stegner-spekuliert-ueber-moegliche-haftstrafe-fuer-clemens-toennies-a-5916dd96-8496-4336-b83e-ccf0ca6b8087";"news";"Stegner spekuliert über mögliche Freiheitsstrafe für Clemens Tönnies";"Bei Tönnies würden Gesetze missachtet, behauptet der schleswig-holsteinische SPD-Fraktionschef Ralf Stegner. Das könne zu persönlichen Konsequenzen für den Chef der Fleischfirma führen.";"SPD-Politiker";2020-07-13 10:23:47;"default";FALSE;"no403_news_free_2020-07-13H10-23-47.png"
"https://www.spiegel.de/panorama/justiz/kinderpornografie-und-strafrecht-das-leiden-der-anderen-kolumne-a-28d03ffc-c7b0-4914-83cb-be0f2003bbd1";"opinion";"Das Leiden der anderen";"In Münster wurde Kinderpornografie entdeckt. Das Publikum kann die Bilder vom Missbrauch nicht sehen, stellvertretend leiden Kommissare. Ein Empathie-Bericht.";"Kinderpornografie und Strafrecht";2020-06-12 11:56:23;"default";FALSE;"no404_opinion_free_2020-06-12H11-56-23.png"
"https://www.spiegel.de/stil/bibbe-hansen-andy-warhol-haette-instagram-geliebt-a-dd206277-c459-4d3e-bb82-95209bff5028";"highlight";"\"\"Andy Warhol hätte Instagram geliebt\"\"";"\"\"Die Magie liegt im Makel\"\", lehrte Warhol sie. Hier spricht Bibbe Hansen über ihre Jugend in New York, ihren Vater, den Künstler und Fluxus-Mitbegründer Al Hansen - und über ihren Sohn, den Popstar Beck.";"Künstlerin Bibbe Hansen über ihre Zeit in der \"\"Factory\"\"";2020-04-19 19:40:27;"default";FALSE;"no405_highlight_free_2020-04-19H19-40-27.png"
"https://www.spiegel.de/reise/deutschland/fast-vergessene-radwege-in-deutschland-warum-faehrt-hier-niemand-a-77a02458-05bf-4c9a-ae97-9af94abcc705";"highlight";"Warum fährt hier niemand?";"Den Elberadweg kennen Sie schon - und die Route an der Donau ist zu voll? Hier sind sechs Geheimtipps: Diese Mehrtagestouren haben Sie fast für sich allein.";"(Fast) vergessene Radwege in Deutschland";2020-06-15 12:11:53;"default";FALSE;"no406_highlight_free_2020-06-15H12-11-53.png"
"https://www.spiegel.de/politik/ausland/andrea-nahles-wird-beraterin-von-eu-sozialkommissar-a-560c8c6c-aefd-4669-ae22-64efa6196ad4";"news";"Andrea Nahles wird Beraterin von EU-Sozialkommissar";"Gut ein Jahr nach ihrem Rückzug vom Parteivorsitz hat Andrea Nahles eine neue politische Aufgabe: Sie soll künftig EU-Sozialkommissar Nicolas Schmit beraten.";"Ex-SPD-Chefin";2020-07-10 16:31:43;"default";FALSE;"no407_news_free_2020-07-10H16-31-43.png"
"https://www.spiegel.de/reise/tipps-fuer-die-radtour-neue-strecken-und-rundwege-in-ganz-deutschland-a-7452c8c8-3903-43b1-b744-9ae9c4ea5ee5";"highlight";"Die neuesten Radwege im ganzen Land";"Deutschland hat weit mehr zu bieten als den Elberadweg: Sightseeing in Berlin, Mountainbiken im Erzgebirge, Meerblick an der Ostsee - die neuen Radtouren aller Bundesländer im Überblick.";"Von Berlin bis Bayern";2020-05-19 17:55:18;"default";FALSE;"no408_highlight_free_2020-05-19H17-55-18.png"
"https://www.spiegel.de/gesundheit/weissfleckenkrankheit-ich-weigere-mich-vitiligo-als-krankheit-zu-sehen-a-86caa5e6-6967-4122-a8e6-89f36fa7fea8";"highlight";"\"\"Ich weigere mich, Vitiligo als Krankheit zu sehen\"\"";"Wie fühlt es sich an, wenn 70 Prozent deines Körpers mit weißen Flecken bedeckt sind? Mariagiovanna aus Mailand spricht über ihre Erfahrungen - und warum Heilung für sie nicht das Wichtigste ist.";"Weißfleckenkrankheit";2020-06-25 17:52:27;"default";FALSE;"no409_highlight_free_2020-06-25H17-52-27.png"
"https://www.spiegel.de/stil/rezept-fuer-pavlova-a-56913840-32cc-49c3-80cc-5b39373ded5f";"highlight";"Heute gibt es Pavlova";"Die Restaurants haben zu, das heißt: Auch am Wochenende müssen wir selbst kochen. Aber was? Die Köchin Verena Lugert hat jeden Tag eine neue Idee. Schnell und einfach. Gut für Leib und Seele.";"Nervennahrung";2020-04-26 09:44:30;"default";FALSE;"no410_highlight_free_2020-04-26H09-44-30.png"
"https://www.spiegel.de/politik/ausland/john-bolton-haette-gegen-donald-trump-aussagen-muessen-kommentar-a-f7780cd9-492e-4d28-865d-ca8900445bfe";"opinion";"Mit Büchern ist Trump nicht zu schlagen";"Donald Trump bittet Staatschefs um Wahlkampfhilfe und träumt davon, Journalisten erschießen zu lassen - was John Bolton in seinem Buch beschreibt, ist skandalös. Aber für die Wahl im November sind diese Enthüllungen zweitrangig.";"Enthüllungen von John Bolton";2020-06-18 17:25:00;"default";FALSE;"no411_opinion_free_2020-06-18H17-25-00.png"
"https://www.spiegel.de/stil/wein-etikettenschwindel-wie-erkenne-ich-eine-faelschung-a-5568a1fa-6e06-4fe9-bd6f-eb220a31753b";"highlight";"Wie erkenne ich eine Fälschung?";"Schenkt der Winzer reinen Wein ein? Stimmen die Angaben auf dem Flaschenetikett? Wer weiß, worauf er achten muss, kann sich mit ein paar Kniffen gegen Betrügereien schützen.";"Etikettenschwindel bei Wein";2020-07-12 17:13:46;"default";FALSE;"no412_highlight_free_2020-07-12H17-13-46.png"
"https://www.spiegel.de/stil/s-magazin/wein-aus-dem-supermarkt-herausragende-weine-bei-lidl-und-aldi-a-00000000-0002-0001-0000-000170854051";"highlight";"Diese Supermarktweine sollten Sie kennen";"Spitzenweine aus Deutschland gibt es mittlerweile auch beim Discounter. Selbst die Winzerelite ist vertreten. Wer weiß, auf welche Namen er achten muss, findet im Regal Topqualität für wenig Geld.";"Günstig und gut";2020-06-12 16:09:10;"default";FALSE;"no413_highlight_free_2020-06-12H16-09-10.png"
"https://www.spiegel.de/panorama/usa-familie-erhaelt-aufruf-zur-wahlregistrierung-fuer-ihre-tote-katze-a-f5bc6bf0-5c7c-4288-8c69-0f11972e190b";"news";"Familie erhält Aufruf zur Wahlregistrierung - für ihre tote Katze";"Die Familie Tims im US-Bundesstaat Georgia hat einen kuriosen Brief erhalten: Darin forderte man Cody Tims auf, sich für die Präsidentschaftswahl anzumelden. Doch Cody ist eine Katze - und seit zwölf Jahren tot.";"USA";2020-07-12 10:53:00;"default";FALSE;"no414_news_free_2020-07-12H10-53-00.png"
"https://www.spiegel.de/deinspiegel/apfelmonster-zubereiten-tipps-gegen-corona-langeweile-folge-18-a-4986d366-4126-43d8-b9e8-b419c0ddee19";"highlight";"Tipps gegen die Corona-Langeweile | Folge 18";"Das \"\"Dein SPIEGEL\"\"-Paket für Kinder-Beschäftigung in harten Zeiten: eine Rezeptidee, ein Quiz, ein Witz und ein Alltagsrätsel.";"Für Kinder (und Eltern)";2020-06-21 16:57:30;"default";FALSE;"no415_highlight_free_2020-06-21H16-57-30.png"
"https://www.spiegel.de/wissenschaft/medizin/coronavirus-und-maskenpflicht-debatte-die-dinger-nerven-na-und-a-af3f749c-17b9-4094-90c7-975198707475";"opinion";"Die Dinger nerven. Na und?";"Deutschland diskutiert über die Maskenpflicht im Kampf gegen Corona. Mal wieder. Dabei ist die Sache ganz einfach: Wer beim Einkaufen oder in der Bahn keine Maske trägt, handelt asozial.";"Debatte über Maskenpflicht";2020-07-06 13:01:05;"default";FALSE;"no416_opinion_free_2020-07-06H13-01-05.png"
"https://www.spiegel.de/stil/rezept-fuer-albondigas-a-d2c75cbb-fcf0-4d7c-8811-9fb83dca2f5a";"highlight";"Heute gibt es Albóndigas";"Die Kita und die Kantine sind immer noch geschlossen? Da hilft nur eins: selbst kochen. Aber bitte schnell und einfach. Die Köchin Verena Lugert hat ein Rezept - das auch noch gegen Fernweh hilft.";"Nervennahrung";2020-05-08 08:20:00;"default";FALSE;"no417_highlight_free_2020-05-08H08-20-00.png"
"https://www.spiegel.de/politik/ausland/massaker-von-srebrenica-vor-25-jahren-die-wunden-sind-nicht-verheilt-bundespraesident-frank-walter-steinmeier-a-39c58def-e51f-4074-87b3-baa4a6e440b1";"news";"\"\"Die Wunden, die vor 25 Jahren in Ihre Gesellschaft gerissen wurden, sind nicht verheilt\"\"";"Ein Verbrechen wie in Srebrenica dürfe nie wieder passieren: 25 Jahre nach dem Massaker an 8000 muslimischen Jungen und Männern ruft Bundespräsident Steinmeier zu Dialog und Versöhnung auf.";"Steinmeier zum Srebrenica-Massaker";2020-07-11 10:08:00;"default";FALSE;"no418_news_free_2020-07-11H10-08-00.png"
