"ArticleUrl";"Type";"Title";"Intro";"Heading";"PublishDate";"Style";"IsPlus";"filename"
"https://www.spiegel.de/politik/deutschland/afd-machtkampf-merkels-schuld-und-chance-a-19254b7d-9a84-48b9-81ad-ac6794abb443";"opinion";"Merkels Schuld und Chance";"Die AfD ist unter der Kanzlerin groß geworden, leider. Das könnten Angela Merkel und die CDU wiedergutmachen. Es bräuchte nur das bisschen Mut, jetzt einzugreifen.";"AfD-Machtkampf";2020-05-25 11:23:41;"default";FALSE;"no106_opinion_free_2020-05-25H11-23-41.png"
"https://www.spiegel.de/stil/s-magazin/clean-beauty-trend-naturkosmetik-in-neuem-gewand-a-319b63e4-4d6e-474a-85cb-4e10134c02c7";"highlight";"Naturkosmetik in neuem Gewand";"Keine Tierversuche, keine problematischen Inhaltsstoffe - und chic verpackt: \"\"Clean Beauty\"\" lässt Naturkosmetik alt aussehen. Dabei sind die Zutaten oft die gleichen. Was ist dran am neuen Pflege-Genre?";"Clean-Beauty-Trend";2020-04-09 02:23:27;"default";FALSE;"no107_highlight_free_2020-04-09H02-23-27.png"
"https://www.spiegel.de/politik/ausland/niederlande-verklagen-russland-wegen-abschuss-von-flug-mh17-a-ff81a513-2c04-4d24-875c-f565e40f57fe";"news";"Niederlande verklagen Russland wegen Abschuss von Flug MH17";"Mit einer sogenannten Staatenklage wollen die Niederlande die Angehörigen der Opfer des Flugzeugabsturzes der MH17 unterstützen. Die Angehörigen hatten bereits vor dem Europäischen Gerichtshof für Menschenrechte geklagt.";"Europäischer Gerichtshof für Menschenrechte";2020-07-10 14:29:49;"default";FALSE;"no108_news_free_2020-07-10H14-29-49.png"
"https://www.spiegel.de/bento/gewalt-in-minneapolis-was-brueder-und-schwestern-in-den-usa-und-deutschland-verbindet-a-55d689ac-e7b6-487c-8aec-ee9d3a7a5fc0";"opinion";"Was uns Schwarze in den USA und Deutschland verbindet";"Wenn es um Polizeigewalt in den USA geht, sagen weiße Deutsche gern zu Schwarzen: \"\"Du kannst froh sein, dass du hier lebst.\"\" Da haben sie etwas falsch verstanden.";"Rassismusdebatte";2020-05-31 17:01:23;"default";FALSE;"no109_opinion_free_2020-05-31H17-01-23.png"
"https://www.spiegel.de/wissenschaft/mensch/klimawandel-warum-die-neuesten-berechnungsmodelle-heisslaufen-a-6a556e48-fa5f-4a48-b2cb-dc582a95022c";"opinion";"Warum die Klimamodelle heißlaufen";"Neue Berechnungen haben die Wissenschaft aufgeschreckt - sie legen nahe, dass die Erde empfindlicher auf Treibhausgase reagieren könnte. Fällt die globale Erwärmung stärker aus als bisher angenommen?";"Stärkerer Temperaturanstieg";2020-05-12 07:41:00;"default";FALSE;"no110_opinion_free_2020-05-12H07-41-00.png"
"https://www.spiegel.de/stil/rezept-fuer-wasabi-kartoffelpueree-mit-raeucherforelle-und-marinierten-gurken-a-92ec19bb-8845-48a4-b1bd-cb55e8fd76eb";"highlight";"Heute gibt es Kartoffelpüree mit Trost und Knall";"Die Kita hat zu, die Kantine ist geschlossen. Da hilft nur eins: selbst kochen. Aber bitte schnell und einfach. Die Köchin Verena Lugert zeigt, wie es geht.";"Nervennahrung";2020-04-17 09:14:00;"default";FALSE;"no111_highlight_free_2020-04-17H09-14-00.png"
"https://www.spiegel.de/psychologie/spieleerfinder-reiner-knizia-ich-verliere-lieber-knapp-als-dass-ich-haushoch-gewinne-a-6e83c4f2-75d3-464b-a223-d9de165ccc1e";"highlight";"\"\"Ich verliere lieber knapp, als dass ich haushoch gewinne\"\"";"Er spielt jeden Tag. Er testet, grübelt und verbessert: Reiner Knizia ist professioneller Spieleerfinder – und seit Jahrzehnten einer der erfolgreichsten. Im Gespräch erklärt er, was ein gutes Spiel ausmacht.";"Warum spielen wir, Herr Knizia?";2020-06-04 18:23:34;"default";FALSE;"no112_highlight_free_2020-06-04H18-23-34.png"
"https://www.spiegel.de/kultur/grundgesetz-rasse-raus-aber-kolumne-a-11942987-a9de-4145-860f-4fc96aa98e6e";"opinion";"\"\"Rasse\"\" raus, aber...";"Weil es keine \"\"Rassen\"\" gibt und allein die Verwendung des Wortes \"\"Rasse\"\" schon rassistisch ist, soll es aus dem Grundgesetz gestrichen werden. Eine gute Idee, aber mit dem Streichen ist es nicht getan.";"Grundgesetz";2020-06-18 13:49:04;"default";FALSE;"no113_opinion_free_2020-06-18H13-49-04.png"
"https://www.spiegel.de/panorama/super-mario-bros-videospiel-fuer-rekordsumme-versteigert-a-9978ce77-1742-462e-9f38-ae07c525099b";"news";"\"\"Super Mario Bros.\"\"-Videospiel für Rekordsumme versteigert";"Das Spiel stammt aus dem Entstehungsjahr der \"\"Super Mario\"\"-Games - und ist seit 1985 originalverpackt. Nun ersteigerte es ein anonymer Bieter bei einer Auktion in den USA.";"114.000 US-Dollar";2020-07-11 11:03:00;"default";FALSE;"no114_news_free_2020-07-11H11-03-00.png"
"https://www.spiegel.de/panorama/justiz/fall-walter-luebcke-beihilfe-und-tatverdacht-kolumne-a-1d30cac2-d83f-4fac-aba7-bf7476a90b5f";"opinion";"Beihilfe und Tatverdacht";"Im Verfahren wegen der Tötung von Walter Lübcke ist das Hauptverfahren eröffnet worden. Neben seiner politischen Bedeutung wirft der Fall auch strafrechtliche Fragen auf, zum Beispiel nach der Unterscheidung von Täterschaft und Beihilfe. Ein kleiner Grundkurs.";"Lübcke-Mord";2020-06-05 17:11:08;"default";FALSE;"no115_opinion_free_2020-06-05H17-11-08.png"
"https://www.spiegel.de/panorama/justiz/kinding-vierjaehrige-stirbt-bei-badeunfall-a-6da420cd-a261-49fd-a651-ab9d94e11a2f";"news";"Vierjährige stirbt bei Badeunfall";"In Bayern ist ein vierjähriges Mädchen bei einem Badeunfall ums Leben gekommen. Die genaue Todesursache wird noch ermittelt.";"Bayern";2020-07-12 07:43:15;"default";FALSE;"no116_news_free_2020-07-12H07-43-15.png"
"https://www.spiegel.de/sport/wintersport/nhl-laesst-eishockey-profis-zu-olympia-leon-draisaitl-kuendigt-teilnahme-mit-deutschland-an-a-adb64191-1508-41d1-b324-cca471a10a19";"news";"Draisaitl will mit Deutschland zu den Winterspielen";"Dass die Profis der weltbesten Eishockey-Liga 2018 bei Olympia fehlten, zählte zu den großen Ärgernissen der Winterspiele. Bei kommenden Spielen sind sie wieder dabei - eine gute Nachricht auch für das deutsche Team.";"NHL lässt Profis zu Olympia";2020-07-11 13:18:51;"default";FALSE;"no117_news_free_2020-07-11H13-18-51.png"
"https://www.spiegel.de/wirtschaft/unternehmen/corona-quarantaene-toennies-in-der-kritik-wegen-antrag-auf-lohnkostenerstattung-a-9b0eb25d-a4d1-42e3-9c45-003e1eae81e6";"news";"Schlachtbetrieb Tönnies in der Kritik";"Nach dem massiven Corona-Ausbruch mussten Tausende Mitarbeiter von Tönnies in Quarantäne. Nun will der Konzern finanzielle Unterstützung von Nordrhein-Westfalen. Die Reaktionen darauf sind eindeutig.";"Antrag auf Lohnerstattung";2020-07-12 08:01:32;"default";FALSE;"no118_news_free_2020-07-12H08-01-32.png"
"https://www.spiegel.de/politik/ausland/hagia-sophia-tuerkei-erdogan-verschaerft-spannungen-mit-russland-a-9ab2b537-0f30-48c3-9600-682f4fa9a07a";"news";"Erdogan verschärft die Spannungen mit Moskau";"Noch vor Monatsablauf soll die Hagia Sophia für muslimische Gläubige öffnen. Griechenland spricht von einem \"\"historischen Fehler\"\" - und auch aus Russland kommt scharfer Protest.";"Umwidmung der Hagia Sophia";2020-07-11 16:29:08;"default";FALSE;"no119_news_free_2020-07-11H16-29-08.png"
"https://www.spiegel.de/politik/ausland/australien-china-und-der-klimawandel-wo-heute-schon-morgen-ist-a-26c0cda0-f172-48de-bcfe-d8f6204b90a0";"news";"Wo heute schon morgen ist";"Apokalyptische Waldbrände, sterbende Korallenriffe und ein zunehmend aggressiver Handelspartner: Australien ringt mit großen Herausforderungen - die in den kommenden Jahrzehnten auf den gesamten Westen zukommen.";"Australien, China und der Klimawandel";2020-07-12 16:43:21;"default";FALSE;"no120_news_free_2020-07-12H16-43-21.png"
"https://www.spiegel.de/reise/ostsee-baeder-strand-ampel-warnt-touristen-vor-ueberfuellung-a-63603079-6707-48c6-b017-9184031df3f2";"highlight";"Strand-Ampel warnt Touristen vor Überfüllung";"Am ersten Ferienwochenende waren die Kapazitäten an Ostseestränden teilweise erschöpft, Touristen konnten bestimmte Badeorte nicht mehr anfahren. Hilfe für Ausflügler bietet jetzt der \"\"Strandticker\"\" im Internet.";"Ostseebäder";2020-07-02 18:11:57;"default";FALSE;"no121_highlight_free_2020-07-02H18-11-57.png"
"https://www.spiegel.de/kultur/corona-informationen-die-politik-vergisst-die-aelteren-a-adab3d6a-4f73-445e-bf52-4e951fb30b6a";"opinion";"Opa muss draußen bleiben";"Angela Merkel hat sich bei älteren Menschen dafür bedankt, dass sie so viel Verständnis für die Corona-Maßnahmen haben. Tatsächlich sollte die Politik Senioren besser informieren.";"Corona-Informationspolitik für Ältere";2020-07-07 16:45:17;"default";FALSE;"no122_opinion_free_2020-07-07H16-45-17.png"
"https://www.manager-magazin.de/unternehmen/tech/tiktok-loest-fuehrungschaos-bei-amazon-aus-a-95501b38-6cf8-4546-8bfa-2747b73e72dd";"news";"Teenie-App TikTok löst Chaos bei Amazon aus";"Der TikTok-Konzern Bytedance ist einer der am stärksten wachsenden Konzerne der Welt - und wird von der US-Regierung der Spionage verdächtigt. Der Konflikt erreicht nun auch den US-Giganten Amazon.";"USA prüfen Verbot der Teenie-App";2020-07-11 13:45:00;"default";FALSE;"no123_news_free_2020-07-11H13-45-00.png"
"https://www.spiegel.de/stil/rezept-fuer-risotto-mit-aprikosen-gorgonzola-und-weisser-schokolade-a-fc888572-a1df-4e0d-9741-8136c553dfc1";"highlight";"Heute gibt es Risotto mit weißer Schokolade";"Die Kita hat zu, die Kantine ist geschlossen? Da hilft nur eins: selbst kochen. Aber bitte schnell und einfach. Und trotzdem besonders. Die Köchin Verena Lugert hat ein Rezept.";"Nervennahrung";2020-05-15 08:32:02;"default";FALSE;"no124_highlight_free_2020-05-15H08-32-02.png"
"https://www.spiegel.de/sport/eishockey/eishockey-nhl-profis-stimmen-re-start-mit-spielorten-in-kanada-zu-a-b2b6324e-3a8e-4fde-8372-fa5946d0a455";"news";"Eishockey-Profis stimmen Re-Start der NHL zu";"Ab dem 1. August will die nordamerikanische Eishockey-Liga ihren Betrieb wieder aufnehmen. Spielorte sollen Edmonton und Toronto sein. Auch auf eine Olympia-Erlaubnis für zukünftige Spiele einigten sich Liga und Profis.";"Saisonfinale in Kanada";2020-07-11 07:49:46;"default";FALSE;"no125_news_free_2020-07-11H07-49-46.png"
"https://www.spiegel.de/kultur/wir-bleiben-hier-a-3261f4df-72a0-4d4a-9d24-4e0a4d4d5152";"opinion";"Wir bleiben hier";"Nach dem Mord an Walter Lübcke und rechtsterroristischen Anschlägen in Halle und Hanau denken viele Menschen aus Einwandererfamilien über Auswanderung nach. Aber Walter Lübcke hatte recht: Sollen doch die Nazis gehen.";"Rechtsextremismus";2020-06-02 10:14:27;"default";FALSE;"no126_opinion_free_2020-06-02H10-14-27.png"
"https://www.spiegel.de/politik/ausland/fluechtlinge-in-griechenland-der-verrohte-kontinent-a-903b7299-cf48-41c8-a9c5-929cb83d0c58";"opinion";"Der verrohte Kontinent";"Griechische Grenzschützer haben aller Wahrscheinlichkeit nach einen Migranten erschossen. Die Europäer haben sich ihre Empathie mit Geflüchteten so sehr abtrainiert, dass sich daran kaum jemand stört.";"Schüsse auf Migranten";2020-05-11 15:56:53;"default";FALSE;"no127_opinion_free_2020-05-11H15-56-53.png"
"https://www.spiegel.de/wirtschaft/service/so-klappt-es-mit-dem-grundrecht-aufs-girokonto-a-c0de68c8-43c3-4e9b-85a9-412405642439";"opinion";"So klappt es mit dem Grundrecht aufs Girokonto";"Der Bundesgerichtshof hat die Deutsche Bank verdonnert, ein günstiges Basiskonto anzubieten. Das kann aber nur der Anfang sein - nötig wären deutlich mehr Transparenz und Vergleichbarkeit.";"Druck auf Banken";2020-07-04 12:28:53;"default";FALSE;"no128_opinion_free_2020-07-04H12-28-53.png"
"https://www.spiegel.de/kultur/verschwoerungstheorien-die-echse-des-boesen-kolumne-a-12c7a38f-41db-4bec-949a-a365164cf5ec";"opinion";"Die Echse des Bösen";"Der Kampfbegriff \"\"Verschwörungstheorie\"\" umfasst vieles, womit die Bevölkerung beschäftigt gehalten werden kann. Sonst würde sie sich noch fragen, ob das Prinzip Demokratie wirklich umgesetzt wird.";"Verschwörungserzählungen";2020-07-04 15:39:00;"default";FALSE;"no129_opinion_free_2020-07-04H15-39-00.png"
"https://www.spiegel.de/stil/rezept-fuer-hirten-tabouleh-a-fe1d6595-c51c-40f6-8782-6496f2b01cea";"highlight";"Heute gibt es Hirten-Tabouleh";"Sie wollen heute grillen? Dann hat unsere Köchin Verena Lugert ein einfaches und raffiniertes Rezept für Sie: Ihre Tabouleh-Variante schmeckt sehr gut zu Fleisch - aber auch ohne.";"Nervennahrung";2020-05-19 07:58:01;"default";FALSE;"no130_highlight_free_2020-05-19H07-58-01.png"
"https://www.spiegel.de/gesundheit/schwangerschaft/kaiserschnitt-leitlinie-aerzte-veroeffentlichten-entscheidungshilfe-a-493a8db9-9470-48bf-b20b-8244291289ad";"highlight";"Wann ein Kaiserschnitt sinnvoll ist";"Tausende Frauen bekommen ihr Kind jährlich per Kaiserschnitt - dabei wäre der Eingriff medizinisch oft gar nicht notwendig. Eine ärztliche Entscheidungshilfe soll nun Klarheit schaffen.";"Neue Leitlinie";2020-06-13 16:53:32;"default";FALSE;"no131_highlight_free_2020-06-13H16-53-32.png"
"https://www.spiegel.de/stil/rezept-fuer-shakshuka-a-8cb310c4-b0f4-440f-be50-d9a7599f385b";"highlight";"Heute gibt es Shakshuka";"Die Kita hat zu, die Kantine ist geschlossen? Da hilft nur eins: selbst kochen. Aber bitte schnell und einfach. Und trotzdem besonders. Die Köchin Verena Lugert hat ein echtes Wohlfühlrezept.";"Nervennahrung";2020-05-14 08:36:11;"default";FALSE;"no132_highlight_free_2020-05-14H08-36-11.png"
"https://www.spiegel.de/reise/mallorca-deutsche-urlauber-nach-der-corona-krise-auf-den-balearen-a-6f9d95dd-ac26-42c2-bed0-6c6b5d2ec1f2";"highlight";"\"\"36,1 Grad. Guten Appetit!\"\"";"Die Balearen sind die Ersten, die deutsche Urlauber empfangen. Sicher soll die Reise per Flugzeug und Hotel trotz Corona werden, das wollen Mallorca und TUI an Testreisenden demonstrieren. Der Premierentag.";"Erste Urlauber auf Mallorca";2020-06-16 06:51:31;"default";FALSE;"no133_highlight_free_2020-06-16H06-51-31.png"
"https://www.spiegel.de/kultur/literatur/der-rote-faden-von-rosie-price-in-der-kritik-ein-buch-wie-eine-fernsehserie-a-03085116-04ce-4c7e-9167-cbb255c5bed1";"news";"Ein Roman wie ein TV-Epos";"Kate ist jung, ohne Argwohn und Angst. Als ein Bekannter sie vergewaltigt, durchzieht das Trauma fortan ihr Leben. Die Autorin Rosie Price hat einen furiosen Roman über sexuelle Gewalt geschrieben.";"\"\"Der rote Faden\"\"";2020-07-10 13:23:54;"default";FALSE;"no134_news_free_2020-07-10H13-23-54.png"
"https://www.spiegel.de/kultur/gemeinsam-runter-vom-sockel-a-40f842fd-9d79-4e51-be15-30afdb651f1c";"opinion";"Gemeinsam runter vom Sockel";"Wir sollten unsere rassistische Geschichte kennen und aus ihr lernen - darin sind sich die meisten einig. Aber warum meinen manche, dass gerade deshalb alles beim Alten und jede Kolonialstatue stehen bleiben sollte?";"Anti-Rassismus-Aktionen";2020-06-16 12:03:38;"default";FALSE;"no135_opinion_free_2020-06-16H12-03-38.png"
"https://www.spiegel.de/stil/rezept-fuer-paella-a-e1be20d1-3d3b-4c7a-a99a-de657668417e";"highlight";"Am Wochenende gibt es Paella";"Was in eine Original-Paella gehört und was nicht, hat unsere Köchin Verena Lugert in Valencia gelernt. Sie empfiehlt trotzdem ihre ganz eigene Variante.";"Nervennahrung";2020-06-27 08:23:00;"default";FALSE;"no136_highlight_free_2020-06-27H08-23-00.png"
"https://www.spiegel.de/politik/deutschland/jens-spahn-besorgt-wegen-mallorca-aufpassen-dass-der-ballermann-nicht-ein-zweites-ischgl-wird-a-12ddb184-4b68-4b51-84f5-dd0ebb64f78d";"news";"\"\"Aufpassen, dass der Ballermann nicht ein zweites Ischgl wird\"\"";"Deutschland hat die Corona-Epidemie unter Kontrolle - doch die beginnende Urlaubszeit birgt Risiken. Gesundheitsminister Spahn zeigt sich angesichts der Bilder vom Wochenende auf Mallorca besorgt.";"Gesundheitsminister Spahn";2020-07-13 08:31:23;"default";FALSE;"no137_news_free_2020-07-13H08-31-23.png"
"https://www.spiegel.de/reise/fernweh/corona-und-in-australien-gestrandet-bitte-adoptiert-mich-ich-bin-backpacker-a-7a48ac5f-47d6-43c4-8703-7265465c477d";"highlight";"Bitte adoptiert mich, ich bin Backpacker!";"No work, no travel: Corona stoppte das Australien-Abenteuer Zehntausender Backpacker. Doch wie weitermachen und vor allem: wie unterkommen? Ein junges Paar hilft mit einer Facebook-Seite.";"In Australien gestrandet";2020-06-25 03:43:10;"default";FALSE;"no138_highlight_free_2020-06-25H03-43-10.png"
"https://www.spiegel.de/stil/biologische-bodenerneuerung-mit-tagetes-a-6b727a86-9335-4728-a1d2-636d1f51188a";"highlight";"Wie man sein Rosenbeet wieder fit macht";"Um seinen Gartenboden biologisch zu erneuern, braucht man viele Tagetespflanzen - und noch mehr Geduld. Eine gute Übung in diesen Zeiten.";"Der Wurm drin - die Gartenkolumne";2020-05-23 18:44:18;"default";FALSE;"no139_highlight_free_2020-05-23H18-44-18.png"
"https://www.spiegel.de/familie/gleichstellung-wenn-schwule-maenner-kinder-kriegen-a-e8b6dcac-2d1a-4b7f-bf68-18fff912cdda";"highlight";"Wenn schwule Männer Kinder kriegen";"Eine fremde Frau spendete die Eizelle, eine weitere trug das Baby aus - und jetzt sind Tobias und Dennis Devooght Papas. Wie schwierig war der Weg dahin, und wie geht es der Familie jetzt?";"Gleichstellung";2020-07-12 15:08:11;"default";FALSE;"no140_highlight_free_2020-07-12H15-08-11.png"
"https://www.spiegel.de/politik/deutschland/migration-nach-europa-schluss-mit-der-asyllotterie-a-42c9b88e-4049-4185-a996-c76fc3e74b71";"opinion";"Schluss mit der Asyllotterie";"Die Flüchtlingspolitik der EU ist beschämend konzeptlos. Wenn Deutschland im Juli die Ratspräsidentschaft übernimmt, sollte es endlich eine echte gemeinsame Asylpolitik vorantreiben.";"Migration nach Europa";2020-06-28 07:14:04;"default";FALSE;"no141_opinion_free_2020-06-28H07-14-04.png"
"https://www.spiegel.de/bento/sucht-ist-keine-freie-wahl-a-f1c4824d-88f4-4008-bc10-901c0ec92dae";"news";"\"\"Sucht ist keine freie Wahl\"\"";"Das Verständnis für psychische Erkrankungen wächst. Doch gerade Suchtkranke kämpfen noch immer mit vielen Vorurteilen, gelten als willensschwach und unzuverlässig. Ihre Heilung erschwert das.";"Stigmatisierung von Abhängigen";2020-07-12 05:49:48;"default";FALSE;"no142_news_free_2020-07-12H05-49-48.png"
"https://www.spiegel.de/stil/rem-koolhaas-und-friedensreich-hundertwasser-ideen-fuer-nachhaltige-architektur-a-ca618de2-38f2-4316-953f-b86a4230b181";"highlight";"Der Ein-Mann-Aktivismus";"Zwei Baumeister, zwei Bücher, ein Thema: Wie das Grüne ins Zentrum ihres Schaffens gehört, beantworten Friedensreich Hundertwasser und Rem Koolhaas grundverschieden. Einer ist seiner Zeit weit voraus.";"Grüne Architektur";2020-05-02 07:59:37;"default";FALSE;"no143_highlight_free_2020-05-02H07-59-37.png"
"https://www.spiegel.de/stil/thierry-mugler-ausstellung-in-muenchen-weiblichkeit-als-waffe-a-81458e29-4d7e-4070-b24b-7f69111a0612";"highlight";"Weiblichkeit als Waffe";"Künstler, Kunstschmied, Couturier: Die Münchner Ausstellung \"\"Thierry Mugler: Couturissime\"\" entführt in den Modekosmos eines kreativen Berserkers, dessen Gestaltungswille nicht mal vor ihm selbst Halt macht.";"Thierry-Mugler-Ausstellung in München";2020-05-30 20:12:00;"default";FALSE;"no144_highlight_free_2020-05-30H20-12-00.png"
"https://www.spiegel.de/sport/fussball/formel-1-ferrari-implodiert-beim-grossen-preis-der-steiermark-pressestimmen-a-1868f707-c471-4361-8b87-5965688a813d";"news";"\"\"Ferrari implodiert\"\"";"Auch beim zweiten Saisonrennen in Österreich erlebte Ferrari ein \"\"Fiasko\"\". Die Reaktionen der internationalen Presse zum Ausfall von Sebastian Vettel und Charles Leclerc sind vernichtend.";"Pressestimmen zum Großen Preis der Steiermark";2020-07-13 07:39:12;"default";FALSE;"no145_news_free_2020-07-13H07-39-12.png"
"https://www.spiegel.de/netzwelt/web/donald-trump-seine-strategien-fuer-den-staatsstreich-kolumne-a-ab1efdca-874c-4af9-9a02-2241be3467c1";"opinion";"Donald Trumps Strategien für den Staatsstreich";"Sollte er die Wahl im November verlieren, wird Donald Trump das Ergebnis wohl nicht anerkennen. Niemand wird ihn an einem Staatsstreich hindern können, dafür sorgen er und seine Verbündeten seit Langem vor.";"US-Wahl 2020";2020-06-03 14:36:48;"default";FALSE;"no146_opinion_free_2020-06-03H14-36-48.png"
"https://www.spiegel.de/familie/vatertag-auch-fuer-muetter-was-frauen-sich-verdient-haben-die-midlife-kolumne-a-f5d1db40-559a-4a2d-837d-c2cce34f1ef8";"opinion";"Himmelfahrtskommando";"Am Muttertag gibt es einen Gutschein für \"\"1 x Putzen\"\", am Vatertag Alkohol. Wenn schon überholte Rituale: Sollten Männer und Frauen nicht einfach mal tauschen?";"Alter! – Die Midlife-Kolumne";2020-05-19 12:47:32;"default";FALSE;"no147_opinion_free_2020-05-19H12-47-32.png"
"https://www.spiegel.de/stil/tipps-fuer-mehr-platz-in-der-wohnung-wenn-das-home-zum-office-wird-a-4855e6cb-f4b1-480a-9b5d-014821a7aa21";"highlight";"Wenn das Home zum Office wird";"Der erste Schritt für Platz in der Wohnung? Aufräumen. Doch ist das einmal erledigt, geht noch mehr. Hier verraten drei Innenarchitekten, wie sie mit Licht, Farben und Möbeln arbeiten.";"Tipps für mehr Platz in der Wohnung";2020-06-02 17:48:58;"default";FALSE;"no148_highlight_free_2020-06-02H17-48-58.png"
"https://www.spiegel.de/stil/rezept-fuer-schweinebraten-a-la-moutarde-a-1c4548fe-fb9e-45f0-a3f2-4d8aeaa6032a";"highlight";"Am Wochenende gibt es Schweinebraten à la moutarde";"Der Samstags- oder Sonntagsbraten von unserer Köchin Verena Lugert ist eine bayerisch-französische Kombination. Klingt kompliziert? Ist es aber nicht. Das meiste passiert im Topf von ganz allein.";"Nervennahrung";2020-05-16 08:40:38;"default";FALSE;"no149_highlight_free_2020-05-16H08-40-38.png"
"https://www.spiegel.de/reise/fernweh/reise-fotos-aus-dem-wohnzimmer-ich-mach-mir-die-welt-wie-sie-mir-gefaellt-a-b69b4d0a-07c4-4dc0-bd15-ea8b9d4e78d1";"highlight";"Ich mach mir die Welt, wie sie mir gefällt";"Was macht eine Reisefotografin, wenn sie nicht mehr reisen kann? Erin Sullivan holt sich die weite Welt in die eigene Wohnung - sie verwandelt Decken zu Schluchten und Pfannkuchen in Canyons.";"Fernweh-Fotos aus dem Wohnzimmer";2020-05-02 12:13:48;"default";FALSE;"no150_highlight_free_2020-05-02H12-13-48.png"
"https://www.spiegel.de/wirtschaft/soziales/steinmeier-pocht-auf-mehr-geld-fuer-corona-helfer-a-a13d8c25-2b28-4b46-81d3-96568d465db0";"news";"Steinmeier pocht auf mehr Geld für Corona-Helfer";"Worte des Dankes reichen nicht: Bundespräsident Frank-Walter Steinmeier fordert eine bessere Bezahlung für alle, die während Corona \"\"den Laden am Laufen gehalten haben\"\".";"Bundespräsident";2020-07-12 18:06:02;"default";FALSE;"no151_news_free_2020-07-12H18-06-02.png"
"https://www.spiegel.de/sport/fussball/premier-league-gegen-vereinte-kraefte-verliert-der-fc-chelsea-fast-immer-a-21bbcb72-aa58-44d2-9830-f024be2aefbc";"news";"Gegen \"\"vereinte\"\" Kräfte verliert Chelsea fast immer";"Im Topspiel der englischen Premier League verlor Chelsea deutlich in Sheffield. Verpassen die Blues doch noch die Champions League, liegt das an ihrer kuriosen Bilanz gegen Teams mit dem Namenszusatz United.";"Premier League";2020-07-11 20:50:00;"default";FALSE;"no152_news_free_2020-07-11H20-50-00.png"
"https://www.spiegel.de/reise/haustausch-fuer-den-sommerurlaub-schwaben-statt-schweden-a-9a7f5c94-1bb0-4a33-a5b5-033c620781d2";"highlight";"Schwaben statt Schweden?";"Ob der Sommerurlaub im Lieblingsland klappt? Unklar. Und die besten Unterkünfte zwischen Sylt und Allgäu sind längst weg. Wie wäre es da mit einem Haustausch? Christoph Koch reist schon lange so - und erklärt, wie es geht.";"Haustausch für den Sommerurlaub";2020-05-14 07:57:02;"default";FALSE;"no153_highlight_free_2020-05-14H07-57-02.png"
"https://www.spiegel.de/panorama/leute/benjamin-keough-enkel-von-elvis-presley-mit-27-jahren-gestorben-a-32a4b4f3-239b-466b-a36e-df78c5bde091";"news";"Benjamin Keough mit 27 Jahren gestorben";"Lisa Marie Presley trauert um ihren Sohn Benjamin Keough. Der US-Amerikaner starb im Alter von 27 Jahren. Er war der Enkel von Elvis Presley.";"Enkel von Elvis Presley";2020-07-13 09:58:01;"default";FALSE;"no154_news_free_2020-07-13H09-58-01.png"
"https://www.spiegel.de/kultur/musik/musiker-kazik-das-war-keine-zensur-das-war-eine-kostenlose-promo-aktion-a-372ee3dd-b776-4580-9fd0-1a971d9961d2";"news";"\"\"Das war keine Zensur, das war eine kostenlose Promo-Aktion\"\"";"Ein regierungskritischer Song des Musikers Kazik verschwand aus einer polnischen Hitparade. Hier spricht er über die PiS-Regierung, Meinungsfreiheit und seine gespaltene Heimat.";"Polnischer Musiker Kazik";2020-07-11 18:03:20;"default";FALSE;"no155_news_free_2020-07-11H18-03-20.png"
"https://www.spiegel.de/netzwelt/web/jair-bolsonaro-hat-covid-19-der-todeswunsch-als-politische-kontaktanzeige-kolumne-a-fb2dc6d1-f378-467a-813e-9249297caf39";"opinion";"Der Todeswunsch als politische Kontaktanzeige";"Todeswünsche an prominente Reizfiguren in sozialen Medien verraten mehr über den Absender als über die Adressaten. Und auch wenn sie Hassspiralen in Gang setzen, ist das etwas anderes als die Ankündigung, jemanden zu töten.";"Jair Bolsonaro hat Covid-19";2020-07-08 12:59:00;"default";FALSE;"no156_opinion_free_2020-07-08H12-59-00.png"
"https://www.spiegel.de/wirtschaft/soziales/eu-ratspraesidentschaft-merkels-letzte-chance-a-0a1cc4f1-7dbe-4877-93a0-2f943d82952f";"opinion";"Merkels letzte Chance";"Über Jahre hat die Bundeskanzlerin die chronischen Probleme der EU und des Euro so weit wie möglich von sich geschoben. Gegen Ende ihrer politischen Karriere hat sie nun die Möglichkeit, alte Versäumnisse gutzumachen.";"EU-Ratspräsidentschaft";2020-06-28 08:35:13;"default";FALSE;"no157_opinion_free_2020-06-28H08-35-13.png"
