"ArticleUrl";"Type";"Title";"Intro";"Heading";"PublishDate";"Style";"IsPlus";"filename"
"https://www.spiegel.de/kultur/cambridge-historiker-brendan-simms-ueber-adolf-hitler-und-seine-gegner-a-00000000-0002-0001-0000-000169705090";"news";"\"\"Mir kommt es darauf an, den wahren Krieg zu zeigen, den Hitler führte\"\"";"Der britische Geschichtsforscher Brendan Simms zeichnet ein neues Bild von Adolf Hitler. Dessen Hauptaugenmerk habe nicht, wie weithin angenommen, dem Bolschewismus gegolten, sondern dem anglo-amerikanischen Kapitalismus.";"Cambridge-Historiker über NS-Diktatur";"2020-03-03 23:55:00";"default";TRUE;"no363_news_plus_2020-03-03H23-55-00.png"
"https://www.spiegel.de/geschichte/coronavirus-wie-die-welt-nach-der-pandemie-aussehen-wird-a-00000000-0002-0001-0000-000170114601";"opinion";"Wie die Welt nach der Pandemie aussehen wird";"Von internationalen Krisen und ihren Folgen profitierten oft rechte Populisten. Droht uns das auch nach Covid-19?";"Historiker blickt in die Zukunft";"2020-03-22 23:10:00";"default";TRUE;"no364_opinion_plus_2020-03-22H23-10-00.png"
"https://www.spiegel.de/familie/kostenlose-kita-warum-bayern-lieber-in-qualitaet-investieren-sollte-a-2a37a4cc-8773-40f9-a68f-3f9ea391214f";"opinion";"Mein Kind zahlt einen hohen Preis für die Gratis-Kita";"In München sind Kindergärten neuerdings kostenlos. Klingt gut, ist es aber leider nicht.";"Elternkolumne";"2020-02-06 23:01:00";"default";TRUE;"no365_opinion_plus_2020-02-06H23-01-00.png"
"https://www.spiegel.de/kultur/literatur/tage-mit-felice-von-fabio-andina-sorge-dich-nicht-bade-a-00000000-0002-0001-0000-000171875154";"news";"Sorge dich nicht, bade!";"Der Schweizer Autor Fabio Andina erzählt in seinem Roman \"\"Tage mit Felice\"\" aus dem Alltag eines 90-jährigen Eigenbrötlers. Ein Besuch am Ort des Geschehens.";"Zu Gast bei Schriftsteller Fabio Andina";"2020-07-03 16:00:00";"default";TRUE;"no366_news_plus_2020-07-03H16-00-00.png"
"https://www.spiegel.de/familie/empathie-so-lernen-kinder-mitgefuehl-a-00000000-0002-0001-0000-000169338924";"highlight";"So lernen Kinder Mitgefühl";"Schon Babys versuchen, Mimik und Gestik ihrer Eltern zu deuten - und lernen auf diese Weise Empathie. Aber warum sind manche Kinder darin besser als andere?";"Soziales Verhalten";"2020-03-08 17:35:23";"default";TRUE;"no367_highlight_plus_2020-03-08H17-35-23.png"
"https://www.spiegel.de/wissenschaft/was-uns-im-leben-wirklich-gluecklich-macht-kopie-a-92f6b354-320e-4401-a594-0a16a27798f0";"highlight";"Was uns im Leben wirklich glücklich macht";"Ein guter Therapeut sagt nicht: \"\"Tun Sie dies oder das, dann werden Sie glücklich.\"\" Er fragt: \"\"Was hat Sie das letzte Mal glücklich gemacht?\"\"";"Ärzte, Soziologen und Neuroforscher entschlüsseln die Glücksformel";"2020-02-26 09:48:25";"default";TRUE;"no368_highlight_plus_2020-02-26H09-48-25.png"
"https://www.spiegel.de/familie/tod-wie-jugendliche-trauern-und-was-erwachsene-davon-lernen-koennen-a-9a27e4ba-7128-4001-9806-59bac34a932d";"opinion";"Wie Jugendliche trauern - und was Erwachsene von ihnen lernen können";"Nach einem Schicksalsschlag in der Familie wirken Teenager auf ihre Eltern oft teilnahmslos. Das kann zu Streit führen, sollte es aber nicht.";"Expertin über Umgang mit dem Tod";"2020-04-14 22:35:29";"default";TRUE;"no369_opinion_plus_2020-04-14H22-35-29.png"
"https://www.spiegel.de/politik/deutschland/annegret-kramp-karrenbauer-auf-einmal-macht-sie-alles-richtig-a-00000000-0002-0001-0000-000170323251";"news";"Auf einmal macht sie alles richtig";"Annegret Kramp-Karrenbauer war Parteivorsitzende auf Abruf, bis die Krise kam. Jetzt wirkt sie von Tag zu Tag sicherer. Friedrich Merz dagegen kann seine Stärken nicht mehr ausspielen.";"CDU-Chefin Kramp-Karrenbauer";"2020-04-03 16:00:00";"default";TRUE;"no370_news_plus_2020-04-03H16-00-00.png"
"https://www.spiegel.de/wirtschaft/die-handelskriege-von-donald-trump-schaden-den-farmern-trotzdem-lieben-sie-ihn-a-413779a7-1590-462c-bcd9-b0cc584443f5";"news";"Warum Amerikas Farmer zu Trump stehen";"Viele US-Landwirte leiden unter der Politik des Präsidenten. Dennoch sind sie seine treuen Wähler. Wie ist das möglich?";"US-Landwirte im Handelskrieg";"2020-02-25 23:25:47";"default";TRUE;"no371_news_plus_2020-02-25H23-25-47.png"
"https://www.spiegel.de/politik/ausland/china-hongkong-und-das-sicherheitsgesetz-deutschland-muss-den-menschen-helfen-a-00000000-0002-0001-0000-000171973740";"opinion";"Deutschland, China und die Lehren aus dem Kalten Krieg";"Pekings Handstreich setzt Deutschland und Europa unter Druck. Es ist an der Zeit, eigene Antworten zu finden.";"\"\"Sicherheitsgesetz\"\" in Hongkong";"2020-07-10 16:00:00";"default";TRUE;"no372_opinion_plus_2020-07-10H16-00-00.png"
"https://www.spiegel.de/politik/wie-zwei-berliner-mit-einem-bollerwagen-google-maps-austricksten-a-00000000-0002-0001-0000-000170323263";"news";"Wie zwei Berliner Google Maps austricksten";"Simon Weckert findet, große Unternehmen seien daran schuld, dass Leute wie er den Reichen Platz machen müssten. Also schmiedete er mit seinem Freund einen Plan.";"Bollerwagen voller Smartphones";"2020-04-03 16:00:00";"default";TRUE;"no373_news_plus_2020-04-03H16-00-00.png"
"https://www.spiegel.de/wirtschaft/service/reichtum-vermoegensforscher-erklaert-wie-man-in-deutschland-reich-wird-a-1780d674-2c8f-4fb7-837b-19600b8f7eba";"news";"Wie man in Deutschland reich wird";"Der Soziologe Wolfgang Lauterbach erklärt, warum Einkommen nichts mit Reichtum zu tun hat - und was der beste Weg ist, um zu Geld zu kommen.";"Vermögensforscher erklärt";"2020-07-06 22:07:51";"default";TRUE;"no374_news_plus_2020-07-06H22-07-51.png"
"https://www.spiegel.de/panorama/frauen-und-der-endlose-weg-zum-richtigen-mann-a-00000000-0002-0001-0000-000074948235";"news";"Der endlose Weg zum richtigen Mann";"Wie stellen sich Frauen an, die einen Partner suchen, was wünschen sie - und woran scheitern sie? Ein SPIEGEL+-Bestseller.";"Die Paarungsfalle";"2010-11-07 17:00:00";"default";TRUE;"no375_news_plus_2010-11-07H17-00-00.png"
"https://www.spiegel.de/geschichte/klaus-von-dohnanyi-erinnert-sich-an-1945-auf-dem-damenrad-durchs-befreite-deutschland-a-0c82b216-fd1c-426d-a20d-ba29b03be60f";"opinion";"So fuhr ich auf dem Damenrad durchs befreite Deutschland";"Als der Krieg endete, machte ich mich auf die Suche nach meiner Familie. Ich radelte Hunderte Kilometer von Mecklenburg über den Harz und Hessen bis nach Oberfranken - und sah, wie die Welt in Frieden aufblühte.";"Mein Sommer 1945";"2020-05-03 12:07:24";"default";TRUE;"no376_opinion_plus_2020-05-03H12-07-24.png"
"https://www.spiegel.de/panorama/leute/mario-adorf-ueber-geld-ich-war-bezahlbar-aber-nicht-kaeuflich-a-00000000-0002-0001-0000-000170768115";"opinion";"Ich war bezahlbar, aber nicht käuflich";"Ich habe Geld an sich nicht geliebt, nie die Gier nach mehr und mehr empfunden. Die teuerste Mahlzeit meines Lebens kostete mich einen Wochenlohn am Bau: unglaubliche 84 Mark.";"Mein Geld, mein Leben";"2020-05-13 14:20:46";"default";TRUE;"no377_opinion_plus_2020-05-13H14-20-46.png"
"https://www.spiegel.de/wissenschaft/natur/teilchenforschung-uns-bleiben-nur-zwei-millionstel-sekunden-a-00000000-0002-0001-0000-000169356847";"news";"\"\"Uns bleiben nur zwei Millionstel Sekunden\"\"";"Allen Caldwell, Direktor am Max-Planck-Institut für Physik in München, erklärt, wie Myonen die Teilchenforschung revolutionieren könnten und welche Schwierigkeiten es bei dem neuen Verfahren gibt.";"Physiker über Durchbruch in der Teilchenforschung";"2020-02-07 17:00:00";"default";TRUE;"no378_news_plus_2020-02-07H17-00-00.png"
"https://www.spiegel.de/politik/deutschland/rassismus-und-diskriminierung-unsere-alltaeglichen-vorurteile-a-00000000-0002-0001-0000-000171527045";"opinion";"Unsere alltäglichen Vorurteile";"Als schwarzer Mann, der schon viel über Diskriminierung nachgedacht hatte, hielt ich mich eigentlich für immun gegen Klischees. Ein Irrtum.";"Diskriminierung";"2020-06-12 16:00:00";"default";TRUE;"no379_opinion_plus_2020-06-12H16-00-00.png"
"https://www.spiegel.de/gesundheit/covid-19-spaetfolgen-drei-patienten-und-ihre-mysterioesen-rueckfaelle-a-68b89da4-22a8-4aff-97dc-c6c74daa064f";"highlight";"Drei Covid-19-Patienten und ihre mysteriösen Rückfälle";"Als der 30-jährige Simon S. an Covid-19 erkrankte, machte er sich kaum Sorgen. Doch Wochen nach seiner Genesung kamen die Symptome zurück, schlimmer als zuvor. Berichte dieser Art häufen sich - Ärzte können sie nicht erklären.";"Leichter Verlauf, schwere Schäden";"2020-06-23 13:43:16";"default";TRUE;"no380_highlight_plus_2020-06-23H13-43-16.png"
"https://www.spiegel.de/panorama/justiz/tinder-schwindler-betrog-reihenweise-frauen-schneeballsystem-der-liebe-a-00000000-0002-0001-0000-000168892029";"news";"Mister Tinder";"Shimon Hayut reist durch Europa und lernt junge Frauen im Internet kennen. Er betrügt sie zeitgleich und über Jahre und nimmt sie aus. Bis er einen Fehler macht.";"Hochstapler betrog reihenweise Frauen";"2020-01-10 17:00:00";"default";TRUE;"no381_news_plus_2020-01-10H17-00-00.png"
"https://www.spiegel.de/sport/agit-kabayel-weisst-du-wie-oft-ich-daran-gedacht-habe-eine-kriminelle-karriere-zu-starten-a-00000000-0002-0001-0000-000171973747";"news";"\"\"Weißt du, wie oft ich daran gedacht habe, eine kriminelle Karriere zu starten\"\"";"Agit Kabayel will erster deutscher Schwergewichtsweltmeister seit Max Schmeling werden. Über den Traum eines Jungen aus Bochum-Wattenscheid, der beinahe früh gescheitert wäre.";"Schwergewichtsboxer Agit Kabayel";"2020-07-10 16:00:00";"default";TRUE;"no382_news_plus_2020-07-10H16-00-00.png"
"https://www.spiegel.de/gesundheit/diagnose/epilepsie-bei-kindern-was-die-diagnose-fuer-eine-familie-bedeutet-a-eecd045f-cfa9-4523-b243-ad2e31f49239";"highlight";"Das Gewitter in Sebastians Kopf";"Ein Neunjähriger hat Epilepsie. Was heißt das für die Familie? Und wie geht man mit der Angst vor dem nächsten Anfall um?";"Epilepsie bei Kindern";"2020-06-02 22:35:52";"default";TRUE;"no383_highlight_plus_2020-06-02H22-35-52.png"
"https://www.spiegel.de/kultur/literatur/arthur-schnitzlers-traumhafte-erotik-schoener-schreiben-a-6ee4d454-1670-4e8c-8b77-4415131fbbe9";"opinion";"Die Lust des Schauens, die Qual des Verlangens";"Unser Kolumnist zeigt an Beispielen, wie kraftvoll die deutsche Sprache sein kann. Folge 34: Arthur Schnitzlers traumhafte Erotik.";"Schöner schreiben - Die Deutschkolumne";"2020-05-07 22:46:42";"default";TRUE;"no384_opinion_plus_2020-05-07H22-46-42.png"
"https://www.spiegel.de/familie/wenn-eltern-sich-trennen-wie-sagt-man-es-den-kindern-a-7890a3ea-f231-40fb-b5ac-3ceccc65b1b1";"highlight";"Wie sage ich den Kindern, dass Mama und Papa sich trennen?";"Ralf M. und seine Frau gehen auseinander, nun werden es auch ihre Kinder erfahren. Familienberater Mathias Voelchert erklärt, worauf Eltern dabei achten sollten.";"Wie sage ich es? – Die Ratgeber-Kolumne";"2020-02-15 15:26:40";"default";TRUE;"no385_highlight_plus_2020-02-15H15-26-40.png"
"https://www.spiegel.de/familie/ostern-in-der-familie-warum-ich-dieses-ritual-feiere-auch-wenn-ich-nicht-glaeubig-bin-a-a6269da0-c1a3-41cf-b70d-63dc6dcff836";"opinion";"Ostern, meine Großfamilie und ich";"Wer hat Jesus das Abendbrot ermöglicht, ihm die Latschen gekauft? Das war ein Patchwork-Vater.";"Elternkolumne";"2020-04-09 23:14:43";"default";TRUE;"no386_opinion_plus_2020-04-09H23-14-43.png"
"https://www.spiegel.de/politik/ausland/us-wahl-donald-trump-wird-die-sache-noch-drehen-sagt-ex-chefstratege-der-republikaner-a-00000000-0002-0001-0000-000171973741";"news";"\"\"Ich verstehe, dass viele Trump für einen Trottel halten. Aber was ist die Alternative?\"\"";"Mike Davis war einer der ruchlosesten und erfolgreichsten Vordenker der US-Republikaner. Nun fragt er sich, wie die Präsidentschaft Donald Trumps noch zu retten ist.";"Ehemaliger Stratege der Republikaner";"2020-07-10 16:00:00";"default";TRUE;"no387_news_plus_2020-07-10H16-00-00.png"
"https://www.spiegel.de/psychologie/tipps-gegen-flugangst-akut-helfen-atemuebungen-a-45ce566f-35ba-44da-8f1e-6ffc24cd72d7";"highlight";"\"\"Akut helfen Atemübungen\"\"";"Verena Kantrowitsch litt unter Flugangst. Hier erklärt die Psychologin, wie sie sich selbst heilte – und was sie anderen empfiehlt.";"Psychologin gibt Tipps gegen Flugangst";"2020-01-28 23:31:06";"default";TRUE;"no388_highlight_plus_2020-01-28H23-31-06.png"
"https://www.spiegel.de/partnerschaft/homosexualitaet-in-deutschland-als-schwulsein-strafbar-war-a-b1ba5ff4-fcdd-402e-87e2-3f8f860056fd";"highlight";"\"\"Was das für ein Scheißleben ist, wenn man sich verstecken muss\"\"";"Günter Werner traf sich 1960 mit einem Soldaten in einer Pension. Wegen des \"\"Schwulenparagraphen\"\" 175 wurde er zu einer Gefängnisstrafe verurteilt. Bis zu seiner Rehabilitation dauerte es fast 60 Jahre.";"Als Schwulsein in Deutschland strafbar war";"2020-02-09 07:17:54";"default";TRUE;"no389_highlight_plus_2020-02-09H07-17-54.png"
"https://www.spiegel.de/reise/nachhaltiges-reisen-die-umweltschweine-sind-immer-die-anderen-a-e817ea5a-4e12-427f-a26d-2db0f0df8bd2";"highlight";"\"\"Die Umweltschweine sind immer die anderen\"\"";"Dürfen wir noch in die Ferne fliegen? Psychologe Martin Lohmann spricht über das Klimadilemma – und erklärt, warum zu Hause bleiben keine Lösung ist.";"Tourismusforscher über nachhaltiges Reisen";"2020-01-23 11:00:00";"default";TRUE;"no390_highlight_plus_2020-01-23H11-00-00.png"
"https://www.spiegel.de/partnerschaft/selbstbetrug-woran-viele-freundschaften-und-liebesbeziehungen-leiden-a-b4051950-f261-4b5f-ac88-19b63c18bfba";"highlight";"\"\"Die Welt ist voll von schwierigen Typen. Oft sind wir selbst die schwierigsten\"\"";"Die Therapeutin und Autorin Lori Gottlieb erklärt, wie Freundschaften und Liebesbeziehungen besser gelingen, wenn man ehrlich mit eigenen Fehlern umgeht - und berichtet dabei von sich selbst.";"﻿Therapeutin über Selbstbetrug in Liebesbeziehungen";"2020-05-10 05:50:56";"default";TRUE;"no391_highlight_plus_2020-05-10H05-50-56.png"
"https://www.spiegel.de/wirtschaft/unternehmen/deutsche-bahn-eine-absurde-lokfuehrervorschrift-kostet-millionen-a-00000000-0002-0001-0000-000169705057";"news";"Absurde Lokführervorschrift kostet die Bahn Millionen";"Mit dem Güterverkehr schreibt die Bahn seit Jahren rote Zahlen. Das liegt auch an einer Regelung zur Arbeitszeit.";"Zum Feierabend daheim";"2020-03-02 23:15:00";"default";TRUE;"no392_news_plus_2020-03-02H23-15-00.png"
"https://www.spiegel.de/auto/sono-motors-baut-solar-auto-sion-tesla-aus-der-waldorfschule-a-00000000-0002-0001-0000-000170604470";"news";"Der Tesla aus der Waldorfschule";"Das Start-up Sono Motors will den großen Herstellern wie Daimler oder BMW mit einem E-Fahrzeug Konkurrenz machen. Ihren Prototypen bauten die Autodidakten mithilfe von YouTube-Videos.";"Deutsche Tüftler und ihr Solar-Auto";"2020-04-24 16:00:00";"default";TRUE;"no393_news_plus_2020-04-24H16-00-00.png"
"https://www.spiegel.de/gesundheit/diagnose/bei-kindern-segelohren-anlegen-lassen-was-ein-hno-arzt-davon-haelt-a-07803719-36f2-46d4-a301-e7fa1d749275";"highlight";"Wenn Eltern eine Schönheits-OP für ihr Kind fordern";"Der Mediziner Christian Lübbers berät Eltern, die ihren Kindern die Segelohren anlegen lassen wollen. Hier erklärt er, wann der Eingriff sinnvoll sein kann und wann er versucht, die Familie umzustimmen.";"HNO-Arzt im Interview";"2020-02-03 14:41:47";"default";TRUE;"no394_highlight_plus_2020-02-03H14-41-47.png"
"https://www.spiegel.de/politik/ausland/grenze-zwischen-griechenland-und-tuerkei-der-todesschuss-fall-muhammad-gulzar-a-75942fba-6caa-429c-9450-1d2251a5d96a";"news";"Der Todesschuss an Europas Grenze";"Ein Pakistaner stirbt beim Versuch, den Grenzzaun zwischen der Türkei und Griechenland zu überwinden. Nun zeigen Recherchen des SPIEGEL, dass er wohl von griechischen Soldaten erschossen wurde.";"Rekonstruktion des Falls Muhammad Gulzar";"2020-05-08 11:00:27";"default";TRUE;"no395_news_plus_2020-05-08H11-00-27.png"
"https://www.spiegel.de/politik/ausland/verfassungsreferendum-in-russland-trotzdem-kein-sieg-fuer-wladimir-putin-a-00000000-0002-0001-0000-000171875132";"news";"Kein Sieg für Putin";"Russlands Autokrat holt sich vom Volk das Recht, praktisch auf Lebzeiten im Kreml zu bleiben. Doch die Elite weiß, wie wenig belastbar das Resultat der Abstimmung ist.";"Verfassungsänderung in Russland";"2020-07-03 16:00:00";"default";TRUE;"no396_news_plus_2020-07-03H16-00-00.png"
"https://www.spiegel.de/familie/wenn-eltern-sich-trennen-bevor-ihr-kind-zur-welt-kommt-muetter-und-vaeter-erzaehlen-a-a2282e92-d964-4bda-b678-2f02bb7dc81f";"highlight";"Wenn Eltern sich trennen, bevor ihr Kind zur Welt kommt";"Kündigt sich ein Baby an, bauen die meisten Paare ein Nest. Doch was ist, wenn die Liebe genau in dieser Zeit zerbricht? Zwei Mütter und zwei Väter erzählen, was sie durchmachten und was ihnen half.";"Zwei Mütter und zwei Väter berichten";"2020-03-15 08:47:00";"default";TRUE;"no397_highlight_plus_2020-03-15H08-47-00.png"
"https://www.spiegel.de/partnerschaft/kein-sex-ist-das-ein-trennungsgrund-das-sagen-experten-und-betroffene-a-be6c725f-d1a0-4cd3-9a30-3e6e432c164d";"highlight";"Was, wenn die Lust am Sex verschwindet?";"Je länger die Beziehung, desto seltener der Sex - das gilt für viele Paare. Manche schlafen irgendwann gar nicht mehr miteinander. Und dann?";"Tipps von Paarberaterinnen und Betroffenen";"2020-07-07 22:07:12";"default";TRUE;"no398_highlight_plus_2020-07-07H22-07-12.png"
"https://www.spiegel.de/panorama/ein-virus-das-auch-den-realitaetssinn-beeintraechtigt-kolumne-a-00000000-0002-0001-0000-000170604460";"opinion";"Richtig, die Neonazis, die sind ja auch noch da";"Vor ein paar Tagen stand ich in einem Baumarkt hinter einem Neonazi. Im Sicherheitsabstand.";"Kolumne aus Brandenburg";"2020-04-28 22:05:00";"default";TRUE;"no399_opinion_plus_2020-04-28H22-05-00.png"
"https://www.spiegel.de/panorama/gesellschaft/casanova-und-serienbetrueger-ich-ergab-mich-ihm-voellig-ich-auch-a-daaa39b3-8c67-40c4-9685-dc56888de40b";"news";"\"\"Ich ergab mich ihm völlig\"\" - \"\"Ich auch\"\"";"Innerhalb weniger Jahre wurden zahlreiche Frauen Opfer eines Serienbetrügers. Erst gestand er ihnen seine Liebe, dann ließ er sie fallen. Vier von ihnen erzählen ihre Geschichte.";"Vier Frauen fielen auf denselben Mann herein";"2020-03-16 13:50:00";"default";TRUE;"no400_news_plus_2020-03-16H13-50-00.png"
"https://www.spiegel.de/wissenschaft/mensch/maya-massengrab-in-mexiko-das-raetselhafte-leichenfeld-von-uxul-a-00000000-0002-0001-0000-000171426738";"news";"Das Leichenfeld von Uxul";"Der Bonner Archäologe Nicolaus Seefeld ist in Mexiko eher zufällig auf mehr als 1300 Jahre alte Skelette gestoßen. Offenbar fielen sie einem Ritual zum Opfer. Irritierend sei \"\"die regelrechte Übertötung\"\".";"Deutscher Forscher entdeckt rätselhaftes Maya-Massengrab";"2020-06-08 22:05:00";"default";TRUE;"no401_news_plus_2020-06-08H22-05-00.png"
"https://www.spiegel.de/wirtschaft/energiewende-in-deutschland-auf-den-preis-kommt-es-an-a-fc06a030-786d-48c1-9503-86213c7901b2";"opinion";"Auf den Preis kommt es an";"Deutsche Ökonomen streiten über Sinn und Unsinn der Ökostrom-Förderung. Mal wieder. Dabei ist die Fachwelt längst weiter.";"Energiewende";"2020-03-10 23:16:08";"default";TRUE;"no402_opinion_plus_2020-03-10H23-16-08.png"
"https://www.spiegel.de/panorama/justiz/wiesbaden-vergiftete-nudelsuppe-der-mysterioese-fall-enrico-r-a-2541b090-76fa-46ba-9c2a-68fc6362fba9";"news";"Der unheimlich hilfsbereite Platzwart";"Blauen Eisenhut ins Essen mischen? Das hätten sie dem freundlichen Enrico R. aus dem Tennisklub nicht zugetraut. Doch da kannten sie seine Lebensgeschichte noch nicht.";"Prozess wegen vergifteter Nudelsuppe";"2020-04-21 22:29:59";"default";TRUE;"no403_news_plus_2020-04-21H22-29-59.png"
"https://www.spiegel.de/politik/deutschland/manuela-schwesig-spd-wir-sind-noch-mittendrin-in-der-pandemie-a-b2a125b9-6c0b-4691-bd63-cf8e8d959b89";"news";"\"\"Wir sind noch mittendrin in der Pandemie\"\"";"Mecklenburg-Vorpommerns Ministerpräsidentin sagt, sie freue sich auf Touristen in den Sommerferien - und erklärt, welche Gäste in ihrem Bundesland nicht willkommen sind.";"Manuela Schwesig verteidigt Einreiseverbote";"2020-06-26 05:39:00";"default";TRUE;"no404_news_plus_2020-06-26H05-39-00.png"
"https://www.spiegel.de/wirtschaft/unternehmen/volkswagens-us-comeback-mit-elektro-autos-vw-gegen-tesla-das-rueckspiel-in-amerika-a-00000000-0002-0001-0000-000169705054";"news";"Volkswagen gegen Tesla - das Rückspiel in Amerika";"Im fünften Jahr nach der Dieselaffäre will sich VW auf dem US-Markt rehabilitieren. Dabei hilft ausgerechnet ein Milliardenprojekt, das als Strafe gedacht war.";"US-Comeback mit Elektroautos";"2020-03-01 22:34:15";"default";TRUE;"no405_news_plus_2020-03-01H22-34-15.png"
"https://www.spiegel.de/politik/deutschland/hartz-iv-reform-in-der-kritik-absolut-lebensfern-a-00000000-0002-0001-0000-000171973733";"news";"\"\"Absolut lebensfern\"\"";"Hartz-IV-Empfänger sollen mehr Geld bekommen - aber nur ein paar Euro. Sozialverbände kritisieren, das Berechnungssystem sei verzerrt, und die Grünen wollen eine radikale Reform.";"Kritik an Hartz-IV-Reform";"2020-07-10 16:00:00";"default";TRUE;"no406_news_plus_2020-07-10H16-00-00.png"
"https://www.spiegel.de/gesundheit/diagnose/das-hilft-wirklich-gegen-reizdarm-a-fabf0e7c-a329-4d35-839f-db7bdec8c469";"highlight";"Das hilft wirklich gegen Reizdarm";"Experten haben zusammengefasst, welche Behandlungsmöglichkeiten bei Durchfall, Verstopfung und Blähungen sinnvoll sind - und was sich Patienten sparen können.";"Neue medizinische Leitlinie";"2020-07-05 05:35:40";"default";TRUE;"no407_highlight_plus_2020-07-05H05-35-40.png"
"https://www.spiegel.de/panorama/hundestrand-was-sind-das-eigentlich-fuer-menschen-dort-a-2c2ab319-f4da-43fb-86c9-4e4eb63aabe2";"opinion";"Was sind das eigentlich für Menschen am Hundestrand?";"Weil das Wetter schön war und wir etwas gegen den Corona-Lagerkoller unternehmen wollten, machten wir einen Ausflug nach Scharbeutz - und merkten: Zu Hause im Garten ist es auch ganz schön.";"Mein Hund, meine Familie und ich";"2020-06-30 08:26:08";"default";TRUE;"no408_opinion_plus_2020-06-30H08-26-08.png"
"https://www.spiegel.de/panorama/gesellschaft/russische-schwestern-wiedersehen-nach-77-jahren-vier-monaten-und-25-tagen-a-00000000-0002-0001-0000-000170435634";"news";"\"\"Warum nur haben sie uns gesagt, du seist tot?\"\"";"Der Weltkrieg trennte sie, beide glaubten, die andere sei gestorben: Die beiden Schwestern Rosa und Julia fanden sich nun wieder - dank ihrer Töchter.";"Schwestern sehen sich nach 77 Jahren wieder";"2020-04-13 22:25:00";"default";TRUE;"no409_news_plus_2020-04-13H22-25-00.png"
"https://www.spiegel.de/gesundheit/inkontinenz-bei-muettern-hilft-workout-fuer-den-beckenboden-a-00000000-0002-0001-0000-000168892066";"highlight";"Workout für den Beckenboden";"Jede zehnte Frau trägt bei der Geburt ihrer Kinder Beckenbodenschäden davon. Was raten Gynäkologen?";"Inkontinenz bei Müttern";"2020-01-15 00:01:00";"default";TRUE;"no410_highlight_plus_2020-01-15H00-01-00.png"
"https://www.spiegel.de/panorama/justiz/ex-gefaengnisdirektor-thomas-galli-will-gefaengnisse-abschaffen-a-14f94035-cdd6-4f87-9b5d-9dd955c22eff";"news";"\"\"Wer nach 30 Ehejahren im Affekt seine Frau umbringt...";"...ist in der Regel für die Allgemeinheit ungefährlich\"\", sagt der frühere JVA-Leiter Thomas Galli. Hier macht er Vorschläge für eine radikale Reform der Strafjustiz.";"Ex-Gefängnisdirektor will Haftstrafen abschaffen";"2020-05-26 22:56:51";"default";TRUE;"no411_news_plus_2020-05-26H22-56-51.png"
"https://www.spiegel.de/wissenschaft/zeit-warum-hat-die-woche-sieben-tage-a-00000000-0002-0001-0000-000074761608";"news";"Warum hat die Woche sieben Tage?";"Jahre, Monate und Tage sind vorgegeben durch Sonne, Mond und Erde. Nur die Woche ist eine Erfindung. Selbst Diktatoren scheiterten daran, sie abzuschaffen - weil sie dem Rhythmus des Körpers entspricht?";"Rätselhafte Zeiteinheit";"2020-03-26 23:14:00";"default";TRUE;"no412_news_plus_2020-03-26H23-14-00.png"
"https://www.spiegel.de/politik/deutschland/fluechtlinge-5-jahre-nach-der-krise-haben-wir-das-geschafft-a-00000000-0002-0001-0000-000171973723";"news";"Haben wir das geschafft?";"2015 suchten beinahe eine Million Menschen Asyl in Deutschland. Was hat das in einem Durchschnittsdorf verändert? Unsere Reporter haben im pfälzischen Haßloch nachgeforscht.";"Bestandsaufnahme fünf Jahre nach der Flüchtlingskrise";"2020-07-10 16:00:00";"default";TRUE;"no413_news_plus_2020-07-10H16-00-00.png"
"https://www.spiegel.de/wirtschaft/soziales/deutschland-als-wasserstoff-pionierland-blau-ist-die-hoffnung-a-00000000-0002-0001-0000-000169356822";"news";"Der Wasserstoff-Plan für Deutschland";"Autos, Heizungen und Industrieanlagen sollen künftig mit Wasserstoff betrieben werden, erzeugt durch Wind- und Sonnenkraft. Kann das funktionieren? Der Realitätscheck.";"Chancen, Kosten, Risiken";"2020-02-07 17:00:00";"default";TRUE;"no414_news_plus_2020-02-07H17-00-00.png"
"https://www.spiegel.de/panorama/aufraeum-coach-gunda-borgeest-fuer-jeden-chaostyp-gibt-es-konkrete-tipps-a-d2426af7-14c4-4803-b0a2-745c7a32a222";"highlight";"\"\"Für jeden Chaostyp gibt es konkrete Tipps\"\"";"Gunda Borgeest arbeitet hauptberuflich als Aufräum-Coach. Hier erklärt sie, warum es wichtig ist, dass jedes Ding einen festen Platz hat.";"Ordnungsexpertin übers Aufräumen";"2020-01-26 23:52:35";"default";TRUE;"no415_highlight_plus_2020-01-26H23-52-35.png"
