"ArticleUrl";"Type";"Title";"Intro";"Heading";"PublishDate";"Style";"IsPlus";"filename"
"https://www.spiegel.de/wirtschaft/unternehmen/wirecard-skandal-verdaechtige-und-profiteure-die-bande-von-aschheim-a-00000000-0002-0001-0000-000171875119";"news";"Die Bande von Aschheim";"Der flüchtige Ex-Vorstand Jan Marsalek gilt als treibende Kraft hinter dem Bilanzschwindel bei Wirecard. Doch an dem mutmaßlichen Milliardenbetrug verdienten viele mit.";"Verdächtige und Profiteure im Wirecard-Skandal";"2020-07-03 09:00:00";"default";TRUE;"no208_news_plus_2020-07-03H09-00-00.png"
"https://www.spiegel.de/gesundheit/diagnose/restless-legs-syndrom-das-hilft-gegen-unruhige-beine-a-459a4f64-316a-42a7-abcf-8ccd79fb780a";"news";"Das hilft gegen unruhige Beine";"Kribbeln, Zucken, Zappeln – wenn sich die Beine beim Einschlafen wie von allein bewegen, treibt das Betroffene in den Wahnsinn. Die Neurologin Juliane Winkelmann verrät, was Sie gegen das Leiden tun können.";"Restless-Legs-Syndrom";"2020-03-09 13:36:00";"default";TRUE;"no209_news_plus_2020-03-09H13-36-00.png"
"https://www.spiegel.de/panorama/gesellschaft/taz-kolumne-zur-polizei-meine-frau-ist-also-muell-a-ac79ae8a-fc51-4853-bd5e-3a9c5e840c44";"opinion";"Meine Frau ist also Müll?";"Seit jemand aus meiner Branche die Branche meiner Frau diffamierte, bin ich ein unfreiwilliger Polizist.";"Debatte über \"\"taz\"\"-Kolumne";"2020-07-03 00:02:50";"default";TRUE;"no210_opinion_plus_2020-07-03H00-02-50.png"
"https://www.spiegel.de/kultur/kino/albrecht-schuch-einer-den-man-nicht-wiedererkennt-a-00000000-0002-0001-0000-000171973764";"news";"Der Teufelskerl";"Mal spielt er einen Banker, mal einen Anti-Aggressions-Trainer, mal einen Gesandten der Hölle: Albrecht Schuch gilt als einer der besten Schauspieler Deutschlands. Jetzt ist er in \"\"Berlin Alexanderplatz\"\" zu sehen.";"Schauspieler Albrecht Schuch";"2020-07-10 16:00:00";"default";TRUE;"no211_news_plus_2020-07-10H16-00-00.png"
"https://www.spiegel.de/politik/corona-und-die-chancen-was-wir-aus-der-krise-lernen-koennen-a-00000000-0002-0001-0000-000169988535";"opinion";"Nichts ist mehr so, wie es war";"Ein Virus wirft den Alltag um. Dieser neuen Lage kann nicht mit alten Parolen begegnet werden. Der Moment zum Nachdenken ist da: über unser Land, über unser Gemeinwesen. Unser Leben.";"Corona und die Chancen";"2020-03-13 17:00:00";"default";TRUE;"no212_opinion_plus_2020-03-13H17-00-00.png"
"https://www.spiegel.de/panorama/leute/kanada-wie-ein-hobbypilot-in-kanada-ein-zeichen-setzte-a-00000000-0002-0001-0000-000171875110";"news";"Da oben muss es besser sein als hier unten";"Sein Bild von einer geballten Faust ging um die Welt. Hobbypilot Dimitri Neonakis geht für seine Kunst regelmäßig in die Luft. Warum tut er das?";"Ein Hobbypilot bemalt den Himmel";"2020-07-03 16:00:00";"default";TRUE;"no213_news_plus_2020-07-03H16-00-00.png"
"https://www.spiegel.de/partnerschaft/junge-maenner-und-sexualitaet-so-entsteht-die-orgasmus-luecke-a-00000000-0002-0001-0000-000171667104";"highlight";"\"\"So entsteht die Orgasmus-Lücke\"\"";"Peggy Orenstein hat in mehr als hundert Interviews junge Männer zu Liebe und Sexualität befragt. Viele haben Sehnsucht, einmal mit Erwachsenen über Pornos zu reden.";"US-Autorin sprach mit jungen Männern über Sex";"2020-06-19 16:00:00";"default";TRUE;"no214_highlight_plus_2020-06-19H16-00-00.png"
"https://www.spiegel.de/panorama/gesellschaft/karneval-darf-sich-mein-kind-als-indianer-verkleiden-a-fff199d9-c757-46fb-9de7-e8d681c5c4a6";"highlight";"Darf sich mein Kind als Indianer verkleiden?";"Wolfgang Oelsner sagt, dass es wichtig für die kindliche Entwicklung ist, in andere Rollen zu schlüpfen und erklärt, warum bestimmte Kostüme besonders beliebt sind.";"Pädagoge über Karneval";"2020-02-18 23:26:08";"default";TRUE;"no215_highlight_plus_2020-02-18H23-26-08.png"
"https://www.spiegel.de/kultur/wir-muessen-so-neutral-sein-wie-moeglich-a-1820e9d1-9cf6-4d3f-8965-aa7a59f8ec66";"opinion";"Wir müssen so neutral sein wie möglich";"Der Kollege Philipp Oehmke schrieb an dieser Stelle, die Zeit der Neutralität im Journalismus sei vorbei. Er hat doppelt unrecht.";"Gegenwart und Zukunft des Journalismus";"2020-06-11 15:49:00";"default";TRUE;"no216_opinion_plus_2020-06-11H15-49-00.png"
"https://www.spiegel.de/reise/europa/lissabon-tipps-an-diesen-orten-treffen-sie-nicht-nur-andere-touristen-a-3b4b849a-2289-40e0-8d3b-e24b6a28eb16";"highlight";"Das sind die schönsten verschwiegenen Ecken von Lissabon";"Wo essen die Einheimischen? Wo verbringen sie ihre Freizeit? Ein Lissabon-Kenner gibt Tipps für Ihre nächste Reise.";"Portugal für Insider";"2020-01-19 23:25:00";"default";TRUE;"no217_highlight_plus_2020-01-19H23-25-00.png"
"https://www.spiegel.de/partnerschaft/maenner-und-ihre-gefuehle-warum-es-so-wichtig-ist-darueber-zu-reden-a-9b0d4aad-ec96-4c88-848b-6ed9a4166001";"highlight";"\"\"Vor tiefer Liebe haben wir Männer doch alle Schiss\"\"";"Der Männerberater Richard Schneebauer hält es für einen Fehler, Gefühle zu unterdrücken. Er plädiert dafür, mit sich selbst offener umzugehen - und auch mit der Partnerin.";"Gefühle in der Beziehung";"2020-05-31 05:26:55";"default";TRUE;"no218_highlight_plus_2020-05-31H05-26-55.png"
"https://www.spiegel.de/wirtschaft/service/haus-umbauen-wie-sie-sich-foerderungen-der-kfw-sichern-a-7d7b7f81-d88c-4f82-b50b-84a13c0945ea";"news";"Sie renovieren, der Staat zahlt";"Wussten Sie, dass die Förderbank KfW Umbauarbeiten an Haus oder Wohnung mitfinanziert? Mir sind fast 2000 Euro entgangen. Bevor es auch bei Ihnen zu spät ist, erkläre ich Ihnen, wie es geht.";"In fünf Schritten zur Haussanierung";"2020-06-07 04:50:38";"default";TRUE;"no219_news_plus_2020-06-07H04-50-38.png"
"https://www.spiegel.de/wirtschaft/nouriel-roubini-sagt-tiefe-wirtschaftskrise-voraus-die-boerse-macht-sich-etwas-vor-a-00000000-0002-0001-0000-000171527063";"news";"\"\"Die Börse macht sich etwas vor\"\"";"Der US-Starökonom Nouriel Roubini zertrümmert die Hoffnung auf eine schnelle Erholung der Weltwirtschaft und prophezeit den USA einen Sommer der Revolte. Auch für Europa sehe es düster aus.";"Ökonom Roubini sagt tiefe Wirtschaftskrise voraus";"2020-06-12 16:00:00";"default";TRUE;"no220_news_plus_2020-06-12H16-00-00.png"
"https://www.spiegel.de/politik/nationale-hausmittel-in-katastrophenzeiten-kolumne-aus-tel-aviv-a-00000000-0002-0001-0000-000170114588";"opinion";"Ich fühlte mich ganz sicher, aber auch wie ein Huhn";"Die Welt geht unter. In Israel scheint das ein bisschen normaler zu sein als anderswo.";"Kolumne aus Tel Aviv";"2020-03-20 17:00:00";"default";TRUE;"no221_opinion_plus_2020-03-20H17-00-00.png"
"https://www.spiegel.de/kultur/musik/fynn-kliemann-silicon-ruespel-a-00000000-0002-0001-0000-000171973766";"news";"Silicon Rüspel";"Er stand auf Platz eins der deutschen Charts - mit einem Album, das er in Eigenregie produziert hat und vertreibt. Konzerte spielt er nicht, die sind ihm zu stressig. Zu Besuch bei Fynn Kliemann.";"Filmemacher und Musiker Fynn Kliemann";"2020-07-12 22:29:00";"default";TRUE;"no222_news_plus_2020-07-12H22-29-00.png"
"https://www.spiegel.de/politik/ausland/papst-franziskus-und-benedikt-xvi-der-teufel-im-vatikan-a-00000000-0002-0001-0000-000169240313";"news";"Zwei Päpste streiten über den Zölibat";"Der frühere Papst Benedikt XVI. strapaziert im Zölibat-Streit einmal mehr die Geduld seines Nachfolgers Franziskus. Warum tut er das?";"Franziskus vs. Benedikt";"2020-01-31 17:00:00";"default";TRUE;"no223_news_plus_2020-01-31H17-00-00.png"
"https://www.spiegel.de/geschichte/marianne-von-weizsaecker-manchmal-spielten-wir-kinder-auch-bombenangriff-a-aaf48747-05f5-43fb-b1bd-d79803538fd7";"opinion";"Manchmal spielten wir Kinder Bombenangriff";"Ich war ja noch sehr jung damals, im Mai 1945 bin ich 13 Jahre alt geworden. Meine Erinnerungen sind die eines Kindes. Wenn Sie meinen Mann noch fragen könnten - der wüsste viel mehr zu sagen.";"Mein Sommer 1945";"2020-05-14 14:47:10";"default";TRUE;"no224_opinion_plus_2020-05-14H14-47-10.png"
"https://www.spiegel.de/psychologie/resilienz-forschung-so-werden-sie-krisenfest-a-00000000-0002-0001-0000-000170716904";"highlight";"So werden Sie krisenfest";"Wie gut Menschen mit Schicksalsschlägen zurechtkommen, hängt von ihrer inneren Widerstandskraft ab. Diese entwickelt sich in der Kindheit – aber sie lässt sich auch fördern.";"Resilienz-Forschung";"2020-05-21 12:44:03";"default";TRUE;"no225_highlight_plus_2020-05-21H12-44-03.png"
"https://www.spiegel.de/politik/corona-krise-als-deutscher-in-italien-ich-verstehe-mein-heimatland-nicht-mehr-a-00000000-0002-0001-0000-000171037342";"opinion";"Ich verstehe mein Heimatland nicht mehr";"Die Deutschen sind bislang gut durch die Pandemie gekommen, gerade im Vergleich zu Italien. Doch jetzt agieren sie mit Bockigkeit, Hartherzigkeit und Hysterie.";"Als Deutscher in Italien";"2020-05-22 16:00:00";"default";TRUE;"no226_opinion_plus_2020-05-22H16-00-00.png"
"https://www.spiegel.de/kultur/rainer-langhans-im-moment-bin-ich-vielleicht-zwoelf-zugleich-uebe-ich-jeden-tag-das-sterben-a-00000000-0002-0001-0000-000171527101";"news";"\"\"Ich übe jeden Tag das Sterben\"\"";"Rainer Langhans, Ikone der 68er-Bewegung, wird bald 80. Hier erzählt er von seinem jüngsten Streit mit Ex-Freundin Uschi Obermaier und erklärt, warum er von Donald Trump mehr hält als von Rezo.";"Rainer Langhans zieht Bilanz";"2020-06-12 11:00:00";"default";TRUE;"no227_news_plus_2020-06-12H11-00-00.png"
"https://www.spiegel.de/wirtschaft/unternehmen/wirecard-und-die-asien-connection-ermittlungen-gegen-partnerfirmen-a-00000000-0002-0001-0000-000171973731";"news";"Wirecards Asien-Connection";"Bei seinen Bilanztricksereien in Asien konnte Wirecard offenbar auf ein Netzwerk aus Ex-Mitarbeitern zählen. Jetzt sind ihnen die Ermittler auf den Fersen.";"Ermittlungen gegen Partnerfirmen";"2020-07-10 12:18:58";"default";TRUE;"no228_news_plus_2020-07-10H12-18-58.png"
"https://www.spiegel.de/politik/iran-rekonstruktion-der-toetung-von-qasem-soleimani-a-393afdbc-f714-4ae6-bb45-61bb855f76d4";"news";"Die letzten Minuten des Schattenkriegers";"Als Irans General Soleimani am 3. Januar in Bagdad landet, warten auf dem Rollfeld zwei Autos. Da hat Donald Trump den Befehl schon erteilt.";"Rekonstruktion der Tötung Soleimanis";"2020-01-07 13:00:57";"default";TRUE;"no229_news_plus_2020-01-07H13-00-57.png"
"https://www.spiegel.de/panorama/justiz/russland-napoleon-experte-walerjewitsch-sokolow-trank-cognac-als-er-die-leiche-zerstueckelte-a-00000000-0002-0001-0000-000171426702";"news";"Napoleons letztes Opfer";"Anastassija Jeschtschenko kam aus der russischen Provinz nach Sankt Petersburg, sie verliebte sich in ihren Dozenten, einen bekannten Napoleon-Experten. Doch ihre Beziehung endete in einer Tragödie.";"Berühmter Historiker tötete seine Geliebte";"2020-06-05 16:00:00";"default";TRUE;"no230_news_plus_2020-06-05H16-00-00.png"
"https://www.spiegel.de/netzwelt/twitter-revolution-verheisst-globalen-frieden-kolumne-a-00000000-0002-0001-0000-000169828681";"opinion";"Vom Tweet zum \"\"Deleet\"\"";"Die nächste Twitter-Revolution verheißt globalen Frieden.";"Twitter kämpft gegen die Dummheit der Nutzer";"2020-03-06 17:00:00";"default";TRUE;"no231_opinion_plus_2020-03-06H17-00-00.png"
"https://www.spiegel.de/politik/deutschland/was-donald-trump-mit-wilhelm-ii-verbindet-a-1bd8bff6-f7dc-46be-8992-daa3d0834c55";"news";"Was Donald Trump mit Wilhelm II. verbindet";"Wer Bücher über den letzten deutschen Kaiser liest, dem fallen erstaunliche Parallelen zum US-Präsidenten auf.";"Sprunghaft, taktlos, narzisstisch";"2020-06-27 05:35:21";"default";TRUE;"no232_news_plus_2020-06-27H05-35-21.png"
"https://www.spiegel.de/politik/ausland/bundesverfassungsgericht-zu-ezb-programm-dieses-urteil-ist-ein-attentat-auf-a-00000000-0002-0001-0000-000170816269";"opinion";"Dieses Urteil ist ein Attentat";"Der Karlsruher Richterspruch droht die EU noch weiter auszuhöhlen.";"Bundesverfassungsgericht zu EZB-Programm";"2020-05-08 16:00:00";"default";TRUE;"no233_opinion_plus_2020-05-08H16-00-00.png"
"https://www.spiegel.de/wirtschaft/service/tipps-fuers-jobinterview-je-konkreter-desto-besser-a-00000000-0002-0001-0000-000169338938";"highlight";"So punkten Sie im Vorstellungsgespräch";"Corinna Vogt ist verantwortlich für die Einstellung von Mitarbeitern bei einer großen Bank. Hier erklärt sie, was Bewerber im Jobinterview tun sollten - und was nicht.";"Personalleiterin gibt Tipps";"2020-02-23 23:33:43";"default";TRUE;"no234_highlight_plus_2020-02-23H23-33-43.png"
"https://www.spiegel.de/panorama/justiz/maddie-mccann-anwalt-von-christian-b-mithaeftlinge-probieren-ihn-zu-schikanieren-wo-es-nur-geht-a-00000000-0002-0001-0000-000171773523";"news";"\"\"Mithäftlinge probieren ihn zu schikanieren, wo es nur geht\"\"";"Der inhaftierte Christian B. steht unter Verdacht, die 2007 verschwundene Madeleine McCann getötet zu haben. Sein Verteidiger Friedrich Fülscher kritisiert Medien und Staatsanwaltschaft.";"Anwalt des mutmaßlichen Maddie-Mörders Christian B.";"2020-06-26 12:00:00";"default";TRUE;"no235_news_plus_2020-06-26H12-00-00.png"
"https://www.spiegel.de/politik/deutschland/spd-was-saskia-esken-und-norbert-walter-borjans-von-der-partei-beziehen-a-f24f4120-08e1-4c8b-b9c8-c2cc47ea8650";"news";"Die Spitzengenossen und ihr Spitzenverdienst";"Die SPD muss sparen, doch die Vorsitzenden Saskia Esken und Norbert Walter-Borjans kassieren nach SPIEGEL-Informationen hohe Aufwandsentschädigungen. In der Partei stößt das auf Unverständnis.";"SPD-Chefs Esken und Walter-Borjans";"2020-06-24 14:34:53";"default";TRUE;"no236_news_plus_2020-06-24H14-34-53.png"
"https://www.spiegel.de/politik/ausland/hongkong-das-ende-der-freiheit-spiegel-podcast-a-ee61a5c6-2324-4ce7-8e66-2d64633b164e";"news";"Das Ende der Freiheit";"Mit dem neuen sogenannten Sicherheitsgesetz zerstört China die Sonderstellung Hongkongs: Was das für die Menschen und die wirtschaftliche Entwicklung der Zone bedeutet, hören Sie im SPIEGEL-Podcast (54:07).";"Sagen, was ist. DER SPIEGEL-Podcast";"2020-07-09 22:16:39";"default";TRUE;"no237_news_plus_2020-07-09H22-16-39.png"
"https://www.spiegel.de/gesundheit/diagnose/feste-zahnspange-als-erwachsene-wuerde-ich-es-wieder-tun-a-178f4375-b4e8-4f21-9eec-0780b1641f45";"highlight";"\"\"Mama, sprich bitte nicht, wenn unsere Freunde da sind\"\"";"Sieht schlimm aus, schmerzt, ist teuer: Die feste Zahnspange ist ein Folterinstrument. Unsere Autorin hat trotzdem eine getragen, 744 Tage lang. Würde sie es wieder tun?";"Feste Zahnspange mit 40 plus";"2020-01-14 08:49:00";"default";TRUE;"no238_highlight_plus_2020-01-14H08-49-00.png"
"https://www.spiegel.de/kultur/jackie-thomae-ueber-ihre-rassismuserfahrung-wie-ich-zu-einer-schwarzen-autorin-wurde-a-00000000-0002-0001-0000-000171527096";"opinion";"Wie ich von einer Berliner Autorin zu einer schwarzen Autorin wurde";"In den vergangenen Tagen bin ich häufig nach meiner Meinung gefragt worden. Teilweise war man sich sicher, sie schon zu kennen. Was eigentlich nur fehlte, war eine Bestätigung der bereits vorformulierten Vermutung.";"Jackie Thomae über Rassismus";"2020-06-12 16:00:00";"default";TRUE;"no239_opinion_plus_2020-06-12H16-00-00.png"
"https://www.spiegel.de/kultur/literatur/die-magie-des-adjektivs-schoener-schreiben-die-deutschkolumne-a-bb44a903-43ac-4bc1-bc7a-3d91268cdd87";"opinion";"Die Magie des Adjektivs";"Unser Kolumnist zeigt an Beispielen, wie kraftvoll die deutsche Sprache sein kann. Folge 32: Joseph Roth, der wusste, was den Unterschied ausmacht zwischen Lamento und Literatur.";"Schöner Schreiben - die Deutschkolumne";"2020-04-11 17:45:55";"default";TRUE;"no240_opinion_plus_2020-04-11H17-45-55.png"
"https://www.spiegel.de/politik/deutschland/jens-spahn-ueber-die-corona-app-14-millionen-downloads-300-gemeldete-faelle-a-00000000-0002-0001-0000-000171875097";"news";"\"\"Hätten wir schon früher Schutzmasken kaufen sollen? Ja, natürlich\"\"";"Waren die Corona-Maßnahmen in Deutschland gerechtfertigt? Im Interview spricht Jens Spahn über seine Versäumnisse, die Lehren aus der Krise - und die Frage, ob wir uns auf eine zweite Welle vorbereiten müssen.";"Minister Spahn über Corona-Krisenmanagement";"2020-07-03 10:00:00";"default";TRUE;"no241_news_plus_2020-07-03H10-00-00.png"
"https://www.spiegel.de/auto/tesla-ingenieur-baut-fahrzeug-um-doch-besser-mit-benzinmotor-a-00000000-0002-0001-0000-000169240325";"news";"Doch besser mit Benzinmotor";"Ein Autoentwickler hat einen Tesla zum Hybridfahrzeug gemacht. Ist das der Schlüssel zur besseren Elektromobilität?";"Ingenieur baut Tesla um";"2020-02-02 18:00:00";"default";TRUE;"no242_news_plus_2020-02-02H18-00-00.png"
"https://www.spiegel.de/politik/deutschland/philipp-amthor-als-jaeger-wenn-man-in-den-wald-geht-muss-man-aufmerksam-sein-a-00000000-0002-0001-0000-000171667060";"news";"\"\"Na siehste, da lernt der Jungjäger was\"\"";"Der CDU-Politiker Philipp Amthor ist Jäger und schießt mit großem Kaliber. Vor seiner Lobbyismusaffäre ließ er sich bei zwei Ausflügen begleiten.";"Auf der Pirsch mit Philipp Amthor";"2020-06-19 11:00:00";"default";TRUE;"no243_news_plus_2020-06-19H11-00-00.png"
"https://www.spiegel.de/reise/erholung-im-urlaub-endlich-abschalten-so-gelingt-es-a-6925d011-3d5b-4bc1-86af-60ed2ceca591";"highlight";"So wird Ihr Urlaub richtig erholsam";"Die Psychologin Christine Syrek erklärt, was Sie tun können, um Ihre Ferien vom ersten Tag an zu genießen - und wie der Effekt möglichst lange anhält.";"Tipps einer Stressforscherin";"2020-06-15 22:32:25";"default";TRUE;"no244_highlight_plus_2020-06-15H22-32-25.png"
"https://www.spiegel.de/psychologie/manipulation-im-job-in-der-beziehung-bei-freunden-schuld-ist-ein-soziales-schmiermittel-a-00000000-0002-0001-0000-000169338925";"highlight";"\"\"Je intimer die Beziehung, desto anfälliger sind wir für Manipulation\"\"";"Wie erkennen wir, dass uns jemand beeinflussen will? Und ist jede Form der Manipulation verwerflich? Der Philosoph Alexander Fischer gibt Antworten.";"Wissenschaftler über die Macht von Schuldgefühlen";"2020-02-25 00:08:00";"default";TRUE;"no245_highlight_plus_2020-02-25H00-08-00.png"
"https://www.spiegel.de/politik/deutschland/friedrich-merz-cdu-schwarz-gruen-sitzt-laengst-am-fruehstueckstisch-a-00000000-0002-0001-0000-000171773532";"news";"\"\"Schwarz-Grün sitzt längst am Frühstückstisch\"\"";"Im Kampf um den CDU-Parteivorsitz galt bislang Armin Laschet als Wegbereiter für eine Koalition mit den Grünen. Jetzt plädiert sein Konkurrent Friedrich Merz für das Projekt - mit sich selbst an der Spitze.";"Friedrich Merz über die Zukunft der CDU";"2020-06-26 08:45:14";"default";TRUE;"no246_news_plus_2020-06-26H08-45-14.png"
"https://www.spiegel.de/reise/fernweh/reisetipps-vom-profi-wie-sie-im-urlaub-besondere-orte-finden-a-88a2c394-db54-456b-9aef-02d65f99aff4";"highlight";"So entdecken Sie im Urlaub besondere Orte - und gehen anderen Touristen aus dem Weg";"Autorin Katharina Maria Zimmermann erklärt, was Sie tun können, um dem Gewimmel an beliebten Reisezielen zu entkommen.";"Reisetipps vom Profi";"2020-01-29 04:53:00";"default";TRUE;"no247_highlight_plus_2020-01-29H04-53-00.png"
"https://www.spiegel.de/politik/ausland/rechte-gewalt-auf-lesbos-wir-wurden-verpruegelt-gejagt-schikaniert-a-84a7667a-703a-46cc-9a06-92cdb0222edc";"opinion";"Wir wurden verprügelt, gejagt, schikaniert";"Ich liebe Lesbos. Doch diesmal wurde ich von einem gewalttätigen Mob angegriffen, der Journalisten und Flüchtlinge hasst. Wer sind diese Menschen? Ich habe versucht, mit ihnen zu reden.";"Rechte Gewalt auf Lesbos";"2020-03-05 16:08:00";"default";TRUE;"no248_opinion_plus_2020-03-05H16-08-00.png"
"https://www.spiegel.de/politik/ausland/darum-muessen-wir-uns-china-entgegenstellen-a-6f320041-65bd-4549-936b-ea1b3448f8a1";"opinion";"Darum müssen wir uns China entgegenstellen";"China übt Gewalt gegen Demonstranten in Hongkong aus und bedroht Taiwan. Wenn die EU dagegen nichts unternimmt, verrät sie ihre Werte. Die Folgen könnten auch in Deutschland dramatisch sein.";"Ein Deutscher in Taiwan";"2020-06-14 15:21:33";"default";TRUE;"no249_opinion_plus_2020-06-14H15-21-33.png"
"https://www.spiegel.de/wissenschaft/corona-hotspot-schlachthof-tiefgefroren-ueberdauern-die-viren-bis-zu-zwei-jahre-a-00000000-0002-0001-0000-000171773514";"news";"Tiefgefroren überdauern die Viren bis zu zwei Jahre";"Wissenschaftler haben herausgefunden, dass Fleischfabriken ideale Lebensräume für Erreger wie Sars-CoV-2 sind. Was folgt daraus?";"Corona-Hotspot Schlachthof";"2020-06-26 16:00:00";"default";TRUE;"no250_news_plus_2020-06-26H16-00-00.png"
"https://www.spiegel.de/panorama/gesellschaft/gilbert-kallenborn-eine-demokratie-lebt-auch-von-einzelkaempfern-a-00000000-0002-0001-0000-000171875107";"news";"Der tägliche Kampf des Gilbert Kallenborn";"Seit Jahren geht ein Vollzeitaktivist juristisch gegen Antisemitismus, Behördenversagen und Geschichtsvergessenheit vor – mit beachtlichem Erfolg. Sein Fall zeigt: Eine Demokratie lebt auch von Einzelkämpfern.";"Ein Mann gegen Politiker und Prominente";"2020-07-03 16:00:00";"default";TRUE;"no251_news_plus_2020-07-03H16-00-00.png"
"https://www.spiegel.de/politik/deutschland/philipp-amthor-ist-der-cdu-jungstar-kaeuflich-a-00000000-0002-0001-0000-000171527043";"news";"Ist Philipp Amthor käuflich?";"Interne Unterlagen der New Yorker Firma Augustus zeigen, wie sich Philipp Amthor von dem Start-up einspannen ließ und später Aktienoptionen und einen Direktorenposten erhielt.";"Der CDU-Jungstar und seine diskrete Lobbyarbeit";"2020-06-12 10:07:00";"default";TRUE;"no252_news_plus_2020-06-12H10-07-00.png"
"https://www.spiegel.de/psychologie/erster-eindruck-wie-verlaesslich-ist-mein-bauchgefuehl-a-00000000-0002-0001-0000-000169338921";"highlight";"13 Millisekunden entscheiden, ob ich dich mag";"Neurowissenschaftler haben Erstaunliches darüber herausgefunden, wie wir auf unbekannte Menschen reagieren. Doch wie zuverlässig ist unser Bauchgefühl?";"Psychologen über Bauchgefühle";"2020-02-16 23:13:06";"default";TRUE;"no253_highlight_plus_2020-02-16H23-13-06.png"
"https://www.spiegel.de/panorama/justiz/fall-frederike-der-mann-der-nicht-zweimal-fuer-denselben-mord-verfolgt-werden-durfte-a-00000000-0002-0001-0000-000171667070";"news";"Die entscheidende Spur kam 32 Jahre zu spät";"Eine 17-Jährige wird vergewaltigt und brutal ermordet, ein Mann gerät in Verdacht. Er wird freigesprochen. Als die Ermittler endlich seine DNA nachweisen können, darf er nicht mehr verfolgt werden.";"Ein Anwalt und sein schwerster Fall";"2020-06-21 22:05:00";"default";TRUE;"no254_news_plus_2020-06-21H22-05-00.png"
"https://www.spiegel.de/politik/ausland/neue-fluechtlingskrise-europa-scheitert-an-den-eigenen-anspruechen-a-00000000-0002-0001-0000-000169828666";"opinion";"Europa scheitert an den eigenen Ansprüchen";"Aus Angst, Flüchtlinge zu ermutigen, lässt Europa eine Brutalität zu, die es nicht akzeptieren kann. Und die nicht nötig ist.";"Neue Flüchtlingskrise";"2020-03-06 17:00:00";"default";TRUE;"no255_opinion_plus_2020-03-06H17-00-00.png"
"https://www.spiegel.de/psychologie/manipulation-im-job-in-der-beziehung-bei-freunden-schuld-ist-ein-soziales-schmiermittel-kopie-a-44c2de04-8df1-48b6-8d9b-4a578c491405";"highlight";"\"\"Je intimer die Beziehung, desto anfälliger sind wir für Manipulation\"\"";"Wie erkennen wir, dass uns jemand beeinflussen will? Und ist jede Form der Manipulation verwerflich? Der Philosoph Alexander Fischer gibt Antworten.";"Wissenschaftler über die Macht von Schuldgefühlen";"2020-02-25 08:17:18";"default";TRUE;"no256_highlight_plus_2020-02-25H08-17-18.png"
"https://www.spiegel.de/panorama/gesellschaft/stadt-der-zukunft-nach-corona-nur-die-jungen-koennen-die-innenstaedte-retten-a-30bc8f65-5bee-4f2f-bf36-e2619d3d424a";"highlight";"So werden wir leben und arbeiten";"Charles Landry ist überzeugt, dass sich unsere Städte mit der Pandemie verändern werden - weil sich unsere Bedürfnisse und Möglichkeiten wandeln.";"Stadtplaner über die Folgen von Corona";"2020-06-09 22:22:24";"default";TRUE;"no257_highlight_plus_2020-06-09H22-22-24.png"
"https://www.spiegel.de/partnerschaft/beziehungs-coaching-paarberater-ueber-versoehnungssex-liebe-und-fremdgehen-a-89e33e39-152c-456e-81ea-a68085aca0d2";"highlight";"\"\"Erst schwindet die seelische Nähe, und im Ergebnis findet kein Sex mehr statt\"\"";"Die Beziehungs-Coaches Eva-Maria und Wolfram Zurhorst beraten seit 20 Jahren Paare in der Krise. Hier sprechen sie über den Unterschied zwischen Liebe und Begehren und über das Problem mit dem Versöhnungssex.";"Paarberater über Langzeitbeziehungen";"2020-02-20 08:41:00";"default";TRUE;"no258_highlight_plus_2020-02-20H08-41-00.png"
"https://www.spiegel.de/kultur/literatur/siegfried-unseld-kuendigt-thomas-bernhard-die-freundschaft-schoener-schreiben-a-98a7cd9c-7d7f-4621-adc0-e09d28c1dffc";"opinion";"Diesseits und jenseits der Schmerzgrenze";"Unser Kolumnist zeigt an Beispielen aus der Literatur, wie kraftvoll die deutsche Sprache sein kann. Folge 35: Verleger Siegfried Unseld kündigt seinem Starautor Thomas Bernhard die Freundschaft.";"Schöner schreiben - Die Deutschkolumne";"2020-05-21 17:31:14";"default";TRUE;"no259_opinion_plus_2020-05-21H17-31-14.png"
"https://www.spiegel.de/gesundheit/diagnose/leben-mit-einer-seltenen-erkrankung-nuri-und-das-halbe-herz-a-f14adebe-546c-4d4d-b84d-7e27eeea271d";"highlight";"Der Junge mit dem halben Herzen";"Das Herz ihres Kindes sei zu schwach, sagte der Arzt noch vor der Geburt. Lebensbedrohlich. Susanne Vogt brachte ihren Sohn Nuri trotzdem zur Welt. Seither kämpft er um sein Leben.";"Leben mit einer seltenen Erkrankung";"2020-07-05 10:02:00";"default";TRUE;"no260_highlight_plus_2020-07-05H10-02-00.png"
