"ArticleUrl";"Type";"Title";"Intro";"Heading";"PublishDate";"Style";"IsPlus";"filename"
"https://www.spiegel.de/panorama/justiz/prozess-in-luebeck-bei-studentenpartys-ging-er-auf-frauenjagd-a-147f9514-d9fe-4995-bed3-a061caddaad0";"news";"Bei Studentenpartys ging er auf Frauenjagd";"Ein 43-Jähriger soll eine betrunkene Studentin verschleppt, vergewaltigt und zum Sterben an einen Feldweg gelegt haben. Bei den Ermittlungen stieß die Polizei auf ein Muster.";"Prozess in Lübeck";"2020-06-11 12:02:24";"default";TRUE;"no105_news_plus_2020-06-11H12-02-24.png"
"https://www.spiegel.de/familie/tod-warum-es-so-wichtig-ist-sich-von-einem-sterbenden-zu-verabschieden-a-c8ae06d0-26a1-4457-a171-6663ec6eb6f9";"opinion";"Warum es so wichtig ist, sich von einem Sterbenden zu verabschieden";"Wenn ein geliebter Mensch im Sterben liegt, hoffen wir auf eine Äußerung, die uns beruhigt, Absolution nach Streitereien, eine Weisung für unser Leben. Doch was, wenn es dazu nicht kommt?";"Expertin über den Umgang mit dem Tod";"2020-05-12 22:06:00";"default";TRUE;"no106_opinion_plus_2020-05-12H22-06-00.png"
"https://www.spiegel.de/fitness/so-ist-joggen-doch-gut-fuers-knie-a-023f6733-7e93-4628-a73a-262245d2c79b";"highlight";"So ist Joggen doch gut fürs Knie";"Laufen macht die Gelenke kaputt? Der Forscher Alessio Bricca erklärt, warum das nicht stimmt - wenn man sich an diese Regeln hält.";"Neue Erkenntnisse aus der Sportmedizin";"2020-06-21 04:52:27";"default";TRUE;"no107_highlight_plus_2020-06-21H04-52-27.png"
"https://www.spiegel.de/familie/hebamme-ueber-menstruation-warum-wir-den-weiblichen-koerper-feiern-sollten-a-b926da8f-bd5a-45ca-8645-a38f2b3dba1e";"opinion";"\"\"Ich verrate euch mal was ziemlich Cooles über den weiblichen Körper\"\"";"Blut, Scham und Schmerzen: Noch heute ekeln sich viele Mädchen mindestens einmal im Monat vor ihrem Körper. Warum das aufhören muss, erklärt Hebamme Agnes Maier in ihrer Kolumne.";"Eine Hebamme berichtet";"2020-03-11 18:08:58";"default";TRUE;"no108_opinion_plus_2020-03-11H18-08-58.png"
"https://www.spiegel.de/gesundheit/diagnose/coronavirus-wie-ich-versuchte-mich-in-berlin-testen-zu-lassen-a-611eb5f3-4cbd-44cd-b2b4-3833610c6691";"highlight";"Wie ich versuchte, in Berlin einen Coronatest machen zu lassen";"Von einer Recherche in Norditalien kehrte ich mit leichten Erkältungssymptomen zurück. Hatte ich mich mit dem Coronavirus infiziert? Es folgte eine Odyssee durch das Berliner Gesundheitssystem.";"Vier Tage Quarantäne";"2020-03-05 09:39:00";"default";TRUE;"no109_highlight_plus_2020-03-05H09-39-00.png"
"https://www.spiegel.de/politik/deutschland/corona-proteste-die-politik-darf-sich-von-verwirrten-verschwoerern-nicht-verrueckt-machen-lassen-a-00000000-0002-0001-0000-000170923471";"opinion";"Manche Demonstranten sind kein Fall für die Politik, sondern für die Psychiatrie";"Man kann mit der Arbeit der Bundesregierung in der Coronakrise unzufrieden sein und deswegen auf die Straße gehen - aber bitte aus den richtigen Gründen.";"Corona-Proteste";"2020-05-18 22:29:00";"default";TRUE;"no110_opinion_plus_2020-05-18H22-29-00.png"
"https://www.spiegel.de/geschichte/brigitte-meese-ueber-den-sommer-1945-es-roch-sehr-deutlich-nach-blut-a-6020407e-625f-41f1-9a6c-b8e72883165f";"opinion";"Es roch sehr deutlich nach Blut";"Als das Frühjahr 1945 in den Sommer überging, verlor meine Mutter ihren Mut. Wir schliefen auf Matratzen in einem Krankenhauskeller in Danzig und wussten nicht mal, dass der Krieg vorbei war.";"Mein Sommer 1945";"2020-06-17 22:24:29";"default";TRUE;"no111_opinion_plus_2020-06-17H22-24-29.png"
"https://www.spiegel.de/politik/ausland/grossbritannien-streit-ueber-china-stuerzt-boris-johnson-in-die-naechste-krise-a-6536c500-e7c3-48b0-83d5-317e8ff526b6";"news";"Boris Johnson hat jetzt noch einen Freund weniger";"Zwischen Briten und Chinesen lief es jahrelang gut, vor allem geschäftlich. Doch Brexit, Corona und Hongkong belasten die Beziehung - mit weitreichenden Folgen.";"Zerwürfnis zwischen Großbritannien und China";"2020-06-24 22:33:17";"default";TRUE;"no112_news_plus_2020-06-24H22-33-17.png"
"https://www.spiegel.de/gesundheit/training-fuer-herz-und-gehirn-wie-gehen-uns-gesund-gluecklich-und-kreativ-macht-a-f1c5e1e9-b42c-47bb-817c-d6e71048f78e";"highlight";"\"\"Gehen ist einer der besten Wege, um uns in Topform zu bringen\"\"";"Der irische Hirnforscher Shane O'Mara erklärt, wie sich Spaziergänge auf Muskeln, Kreislauf und unser Gehirn auswirken. Schon 5000 Schritte extra pro Tag können einen großen Unterschied machen.";"Neurowissenschaftler über Fitness für Herz und Gehirn";"2020-06-28 05:18:41";"default";TRUE;"no113_highlight_plus_2020-06-28H05-18-41.png"
"https://www.spiegel.de/familie/fuehrerschein-im-alter-wenn-die-eltern-besser-nicht-mehr-auto-fahren-sollten-a-e4842720-1646-43e1-ade9-1997c2828759";"highlight";"Wenn der Vater zu alt zum Autofahren wird";"Jörn D. findet, dass sein greiser Vater nicht mehr hinters Lenkrad gehört - allerdings liebt der Senior das Autofahren. Familienberater Mathias Voelchert sagt, was beim Überreden hilft.";"Wie sage ich es? - Die Ratgeber-Kolumne";"2020-03-14 16:13:00";"default";TRUE;"no114_highlight_plus_2020-03-14H16-13-00.png"
"https://www.spiegel.de/politik/ausland/george-floyd-i-can-t-breathe-ein-satz-veraendert-die-welt-a-00000000-0002-0001-0000-000171426670";"opinion";"Der Satz eines Landes, das zu zerreißen droht";"Es gibt Formulierungen, die die Welt auf den Punkt bringen, die sich einbrennen in das Gedächtnis der Menschheit. Den verzweifelten Hilferuf von George Floyd werden wir nie mehr vergessen.";"\"\"I can't breathe\"\"";"2020-06-05 14:00:00";"default";TRUE;"no115_opinion_plus_2020-06-05H14-00-00.png"
"https://www.spiegel.de/gesundheit/diagnose/coronavirus-wie-jeder-seine-atemwege-und-sein-immunsystem-staerken-kann-a-00000000-0002-0001-0000-000170435669";"highlight";"Wie jeder seine Atemwege und sein Immunsystem stärken kann";"Asthmatiker und Raucher sind besonders durch das Coronavirus gefährdet. Doch auch Gesunde sollten ihre Lunge stärken. Wie das geht, erklärt der Münchner Experte Ali Önder Yildirim.";"Lungenbiologe gibt Tipps zur Corona-Prophylaxe";"2020-04-10 16:00:00";"default";TRUE;"no116_highlight_plus_2020-04-10H16-00-00.png"
"https://www.spiegel.de/familie/philosophieren-mit-kindern-kinder-sind-oft-bessere-denker-a-f85d86f2-7f68-4e58-926c-978990a4777d";"highlight";"\"\"Kinder sind oft bessere Denker\"\"";"Woher kommt der Mensch? Was Erwachsene wissen, bringt Kinder zum Staunen - eine gute Voraussetzung zum Philosophieren. Die Erziehungswissenschaftlerin Kerstin Michalik erklärt, wie die ganze Familie davon profitiert.";"Philosophieren in der Familie";"2020-06-01 22:21:00";"default";TRUE;"no117_highlight_plus_2020-06-01H22-21-00.png"
"https://www.spiegel.de/gesundheit/ernaehrung/klimatarier-wie-sie-sich-gesund-und-klimafreundlich-ernaehren-a-78fc4547-2423-4f26-a116-fa8adf7d2f4e";"highlight";"Wie ernähre ich mich gesund und klimafreundlich zugleich?";"Ich möchte so essen, dass es gut für die Umwelt ist. Aber nicht nur Brokkoli und Paprika. Geht das? Ein Selbstversuch.";"Selbstversuch";"2020-02-23 16:12:49";"default";TRUE;"no118_highlight_plus_2020-02-23H16-12-49.png"
"https://www.spiegel.de/kultur/literatur/benjamin-von-stuckrad-barre-soloalbum-ein-trauriger-kleiner-satz-der-alles-zerstoert-a-70f09d9f-88ca-4c0d-ac53-30ea5918b6f5";"opinion";"Ein trauriger kleiner Satz, der alles zerstört";"Unser Kolumnist zeigt an Beispielen aus der Literatur, wie kraftvoll die deutsche Sprache sein kann. Folge 38: Benjamin von Stuckrad-Barres \"\"Soloalbum\"\"";"Schöner schreiben";"2020-07-02 15:27:33";"default";TRUE;"no119_opinion_plus_2020-07-02H15-27-33.png"
"https://www.spiegel.de/psychologie/psycho-test-testen-sie-ihre-krisenkompetenz-a-b0c33569-5378-42ec-916e-cd3529e11faa";"highlight";"Testen Sie Ihre Krisenkompetenz";"Wie gehen Sie mit schwierigen Situationen in Alltag und Berufsleben um? Der große SPIEGEL-WISSEN-Test zeigt es Ihnen - und verrät, wie Sie Ihre Fähigkeiten verbessern.";"Umgang mit schwierigen Lebenslagen";"2020-05-16 12:24:34";"default";TRUE;"no120_highlight_plus_2020-05-16H12-24-34.png"
"https://www.spiegel.de/wissenschaft/medizin/niederlande-muss-tabak-verkaufsstellen-massiv-senken-a-00000000-0002-0001-0000-000169705074";"opinion";"Tabak, adieu";"Warum die Niederlande Zigaretten aus den meisten Läden verbannen – und Deutschland nicht.";"Vorbild Niederlande";"2020-02-28 17:00:00";"default";TRUE;"no121_opinion_plus_2020-02-28H17-00-00.png"
"https://www.spiegel.de/wissenschaft/natur/hans-joachim-schellnhuber-wir-werden-viel-mehr-glueck-brauchen-als-wir-verstand-haben-a-00000000-0002-0001-0000-000171973715";"news";"\"\"Wir werden viel mehr Glück brauchen, als wir Verstand haben\"\"";"Er ist kein Menschenfreund, will aber die Zivilisation retten. Von seinem Institut aus versucht Hans Joachim Schellnhuber, die internationale Politik zu beeinflussen. Begegnungen mit einem anmaßenden Menschen.";"Klimaforscher Schellnhuber";"2020-07-11 06:49:54";"default";TRUE;"no122_news_plus_2020-07-11H06-49-54.png"
"https://www.spiegel.de/wissenschaft/corona-forschung-wann-gibt-es-einen-impfstoff-und-wie-gut-kann-er-schuetzen-a-5305b205-1647-4d16-a678-529c4bd2c298";"news";"Wann gibt es einen Impfstoff - und wie gut kann er schützen?";"Wissenschaftler weltweit arbeiten an einem Impfstoff gegen Sars-CoV-2, unterstützt mit Milliarden. Sie kommen voran. Doch das Virus zu stoppen, ist schwieriger als erhofft.";"Aktueller Stand der Corona-Forschung";"2020-06-19 18:12:52";"default";TRUE;"no123_news_plus_2020-06-19H18-12-52.png"
"https://www.spiegel.de/kultur/daniel-kehlmann-zu-rassismus-protesten-wir-erleben-gerade-eine-kulturelle-revolution-a-00000000-0002-0001-0000-000171973763";"news";"\"\"Wir erleben gerade eine kulturelle Revolution\"\"";"In den USA tobt ein Kulturkampf zwischen Rechten und Linken. Nun fordern 150 Intellektuelle in einem offenen Brief Debattenfreiheit. Auch Daniel Kehlmann hat unterzeichnet. Warum?";"Schriftsteller Daniel Kehlmann über Identitätspolitik";"2020-07-10 15:00:09";"default";TRUE;"no124_news_plus_2020-07-10H15-00-09.png"
"https://www.spiegel.de/politik/deutschland/baden-wuerttemberg-fuehrungskraefte-lassen-winfried-kretschmann-im-stich-a-00000000-0002-0001-0000-000169356800";"news";"Von allen guten Kräften verlassen";"Bis vor Kurzem galt der grüne Ministerpräsident Winfried Kretschmann in Baden-Württemberg als unschlagbar. Jetzt kommt ihm überraschend wichtiges politisches Führungspersonal abhanden.";"Winfried Kretschmann und der grüne Exodus";"2020-02-07 17:00:00";"default";TRUE;"no125_news_plus_2020-02-07H17-00-00.png"
"https://www.spiegel.de/psychologie/aufschieberitis-beenden-wie-man-gute-vorsaetze-in-die-tat-umsetzt-a-0a715b4e-0299-4b61-abd3-3f045e96e3fc";"highlight";"Wie Sie sich jetzt selbst organisieren können";"Gerade beim Arbeiten zu Hause drohen Aufschieberitis und Prokrastination: Der Psychologe Julius Kuhl erklärt, warum bestimmte Persönlichkeitstypen an der Selbstmotivation scheitern - und wie man sich in der Krise nicht verzettelt.";"Aufschieberitis im Homeoffice";"2020-03-18 23:12:00";"default";TRUE;"no126_highlight_plus_2020-03-18H23-12-00.png"
"https://www.manager-magazin.de/lifestyle/rolex-breitling-omega-co-wie-tuner-uhrenklassiker-aufmotzen-a-00000000-0002-0001-0000-000165527088";"news";"Wie Tuner Uhrenklassiker zu Unikaten aufmotzen";"Die Hersteller hassen sie, doch die Zahl der Fans wächst: Kleine Ideenstudios tunen klassische Uhren. Das Facelift mit Gold, Farbe oder Steinen wertet die Einzelstücke sogar auf.";"Gold ist nicht genug";"2020-07-01 07:20:00";"default";TRUE;"no127_news_plus_2020-07-01H07-20-00.png"
"https://www.spiegel.de/wissenschaft/medizin/who-rechnet-mit-weitere-corona-wellen-das-schlimmste-steht-bevor-a-00000000-0002-0001-0000-000171875145";"news";"\"\"Das Schlimmste steht bevor\"\"";"In vielen Weltregionen gerät die Seuche außer Kontrolle. Und in Ländern, die das Virus vorerst eingedämmt haben, drohen neue Ausbrüche - auch in Europa.";"WHO rechnet mit weiteren Corona-Wellen";"2020-07-03 16:00:00";"default";TRUE;"no128_news_plus_2020-07-03H16-00-00.png"
"https://www.spiegel.de/wissenschaft/medizin/coronavirus-die-rolle-der-scheinbar-gesunden-infizierten-a-42db60ea-030d-4263-9a9d-270cf15a7269";"news";"Hätte die Welt nur auf diese Frau gehört";"Die Ärztin Camilla Rothe entdeckte einen der ersten Hinweise, dass Menschen ohne Symptome das Coronavirus übertragen können. Doch Behörden ignorierten die Beobachtung. Mit möglicherweise weitreichenden Folgen.";"Eine Münchner Ärztin und ihre Corona-Warnungen";"2020-06-30 22:32:57";"default";TRUE;"no129_news_plus_2020-06-30H22-32-57.png"
"https://www.spiegel.de/politik/ausland/john-bolton-schreibt-ueber-donald-trump-der-nordpol-ist-oben-a-00000000-0002-0001-0000-000171667090";"opinion";"Der Nordpol ist oben";"Ein neues Buch beschreibt den US-Präsidenten als einfältigen Ignoranten, der neben vielem anderen nicht weiß, ob Finnland zu Russland gehört. Gute Gelegenheit für weitere Klarstellungen.";"Bolton und Trump";"2020-06-19 16:00:00";"default";TRUE;"no130_opinion_plus_2020-06-19H16-00-00.png"
"https://www.spiegel.de/politik/ausland/donald-trump-gegen-die-sozialen-medien-die-twitter-daemmerung-a-00000000-0002-0001-0000-000171168373";"news";"Die Twitterdämmerung";"Der US-Präsident will weiter ungestört Unwahrheiten verbreiten dürfen. Weil Twitter das nicht mehr hinnehmen möchte, holt Trump zum großen Schlag aus - und bedroht die sozialen Netzwerke.";"Donald Trump legt sich mit seinem Lieblingsmedium an";"2020-05-29 11:14:22";"default";TRUE;"no131_news_plus_2020-05-29H11-14-22.png"
"https://www.spiegel.de/reise/fernweh/suedafrika-so-reisen-sie-sicher-durch-eins-der-schoensten-laender-der-welt-a-562a5b73-7ba0-43c8-ad18-9da13bd8160a";"highlight";"So reisen Sie sicher durch Südafrika";"Raubüberfälle am Tafelberg, Carjacking an der Ampelkreuzung? Trotz der heiklen Sicherheitslage können Sie Ihren Urlaub genießen, wenn Sie diese Regeln beachten.";"Insidertipps";"2020-01-12 23:38:00";"default";TRUE;"no132_highlight_plus_2020-01-12H23-38-00.png"
"https://www.spiegel.de/politik/deutschland/gerhard-schroeder-frau-merkel-hat-ein-vakuum-geschaffen-das-raecht-sich-jetzt-a-00000000-0002-0001-0000-000169828686";"news";"\"\"Frau Merkel hat ein Vakuum geschaffen, das rächt sich jetzt\"\"";"Ex-Regierungschef Gerhard Schröder spricht im Interview über die Fehler der Kanzlerin - und nennt mögliche SPD-Kandidaten für das Amt.";"Altkanzler Schröder im SPIEGEL-Gespräch";"2020-03-06 09:18:00";"default";TRUE;"no133_news_plus_2020-03-06H09-18-00.png"
"https://www.spiegel.de/familie/hochbegabung-wenn-das-eigene-kind-schlauer-ist-als-man-selbst-a-aca8bbc5-b07c-4abc-966c-859fbe8d1e3a";"highlight";"Hilfe, meine Tochter ist schlauer als ich";"Mit zwei Jahren redete Margret Thiems Tochter wie eine Erwachsene, mit neun zitiert sie Goethe. Hier berichtet die Mutter von ihrem Leben mit einem hochbegabten Kind - das bei vielen als seltsam gilt.";"Hochbegabung";"2020-03-03 23:57:58";"default";TRUE;"no134_highlight_plus_2020-03-03H23-57-58.png"
"https://www.spiegel.de/gesundheit/sex/wie-frauen-sex-empfinden-katja-lewina-ueber-pubertaet-lust-und-analsex-a-a8fa9c97-3a91-44e3-98eb-dab28da7cea9";"news";"\"\"Als meine Tochter mich nach Gruppensex fragte, bin ich versteinert\"\"";"Sie hat Sex und will darüber reden, deswegen hat die Autorin Katja Lewina ein Buch geschrieben. Ein Gespräch über weibliches Begehren, Analsex und Scham.";"Weibliche Lust";"2020-03-28 07:26:51";"default";TRUE;"no135_news_plus_2020-03-28H07-26-51.png"
"https://www.spiegel.de/familie/tod-der-eltern-wie-gehe-ich-mit-trauer-um-a-df248795-7147-4b5b-918e-b28cfa6e3e7e";"opinion";"Wie gehe ich damit um, wenn meine Eltern sterben?";"Sie gaben uns Halt und uneingeschränkte Liebe – und plötzlich sind sie nicht mehr da. Was macht der Tod der eigenen Eltern mit uns? Unsere Kolumnistin berichtet von ihren Erfahrungen als Trauerbegleiterin.";"Trauerbegleiterin gibt Rat";"2020-02-27 09:33:00";"default";TRUE;"no136_opinion_plus_2020-02-27H09-33-00.png"
"https://www.spiegel.de/wissenschaft/fasten-und-kalorienreduzierte-ernaehrung-die-effekte-sind-enorm-a-557a03a0-046b-4e87-ba71-94d8e528072b";"news";"\"\"Die Effekte sind enorm\"\"";"Wie ernährt sich ein Ernährungsexperte? Im Interview spricht Valter Longo über Kalorienpausen, gesunde Kohlenhydrate und das Essen unserer Großeltern.";"Kalorienreduzierte Ernährung";"2018-08-04 12:40:03";"default";TRUE;"no137_news_plus_2018-08-04H12-40-03.png"
"https://www.spiegel.de/politik/ausland/griechenland-setzt-offenbar-fluechtlinge-auf-dem-meer-aus-a-14b5cf26-df90-4838-83c0-f5a2d6bdd7b9";"news";"Griechenland setzt offenbar Flüchtlinge auf dem Meer aus";"Gemeinsame Recherchen von SPIEGEL, Report Mainz und Lighthouse Reports zeigen: Die griechische Küstenwache greift Bootsflüchtlinge auf, setzt sie auf Rettungsinseln, schleppt sie Richtung Türkei und überlässt sie ihrem Schicksal. Was wissen deutsche Einsatzkräfte davon?";"Augenzeugen und Videos belasten Küstenwache";"2020-06-16 16:00:03";"default";TRUE;"no138_news_plus_2020-06-16H16-00-03.png"
"https://www.spiegel.de/familie/geschwisterkinder-ist-es-okay-ein-lieblingskind-zu-haben-a-1d16412a-c9d6-497e-b3c4-da4e07e8e71c";"highlight";"Müssen Eltern ihre Kinder immer gleich behandeln?";"Immer wieder kommt es vor, dass Kinder sich gegenüber ihren Geschwistern zurückgesetzt fühlen - mitunter zu Recht. Familienforscher Hartmut Kasten erklärt, wann und wie Eltern gegensteuern sollten.";"Forscher über Prinzessinnen-Syndrom";"2020-04-13 01:53:44";"default";TRUE;"no139_highlight_plus_2020-04-13H01-53-44.png"
"https://www.spiegel.de/kultur/musik/bayreuther-festspiele-abgesagt-katharina-wagner-erkrankt-der-wagner-schock-a-00000000-0002-0001-0000-000170716230";"news";"Der Wagner-Schock";"Die Festspielleiterin Katharina Wagner fällt längerfristig aus. Es ist das nächste Drama auf dem Grünen Hügel.";"Chefin der Bayreuther Festspiele erkrankt";"2020-05-01 16:00:00";"default";TRUE;"no140_news_plus_2020-05-01H16-00-00.png"
"https://www.spiegel.de/kultur/literatur/theodor-w-adorno-und-das-busenattentat-schoener-schreiben-die-deutschkolumne-a-1614d5b6-08c7-4118-859f-c2be34b24a1b";"opinion";"Das \"\"Busenattentat\"\" und ein Adorno-Moment";"Unser Kolumnist zeigt an Beispielen, wie kraftvoll unsere Sprache sein kann. Folge 31: Der Philosoph Theodor W. Adorno demonstrierte mit nur zwei Wörtern, dass er deutlicher sah als andere.";"Schöner Schreiben - die Deutschkolumne";"2020-03-25 23:36:00";"default";TRUE;"no141_opinion_plus_2020-03-25H23-36-00.png"
"https://www.spiegel.de/panorama/gesellschaft/kindesmissbrauch-warum-muetter-zu-mittaetern-werden-a-eac1c8c1-d715-4d01-bbe0-ff8c06dfa8ce";"news";"Warum Mütter zu Mittätern werden";"Meist sind es Männer, die Kinder missbrauchen. Doch häufig gibt es Frauen in ihrem Umfeld, die die Täter unterstützen, wegsehen, die Opfer allein lassen - oft ist das deren leibliche Mutter.";"Psychiater über Kindesmissbrauch";"2020-06-13 16:31:13";"default";TRUE;"no142_news_plus_2020-06-13H16-31-13.png"
"https://www.spiegel.de/familie/hochbegabtes-kind-meine-mutter-hat-irgendwann-angefangen-so-zu-denken-wie-ich-a-56a38d46-868a-4bdb-8068-b124e0b1de98";"highlight";"\"\"Oft fehlt einfach das Wissen, um Hochbegabung zu erkennen\"\"";"Als Kind war sie zerstreut, als Jugendliche depressiv - dabei hatte Lydia einfach nur einen sehr hohen IQ. Ihre Mutter hat versucht, sie bestmöglich aufs Leben vorzubereiten. Erfolgreich?";"Eine Mutter und ihre superintelligente Tochter";"2020-05-24 05:28:41";"default";TRUE;"no143_highlight_plus_2020-05-24H05-28-41.png"
"https://www.spiegel.de/netzwelt/web/angela-merkel-wie-russische-hacker-die-mailkonten-der-bundeskanzlerin-knackten-a-00000000-0002-0001-0000-000170816296";"news";"Wie russische Hacker Angela Merkels Mailkonten knackten";"Ermittler sind sicher, dass der russische Militärgeheimdienst dahintersteckt: Unbekannte verschafften sich 2015 Zugriff zu Dienstrechnern der Kanzlerin - die enthielten den kompletten E-Mail-Verkehr aus ihrem Abgeordnetenbüro ab 2012.";"Rekonstruktion eines Cyberangriffs";"2020-05-08 08:08:00";"default";TRUE;"no144_news_plus_2020-05-08H08-08-00.png"
"https://www.spiegel.de/geschichte/muehldorf-am-inn-rekonstruktion-der-letzten-ritterschlacht-1322-a-00000000-0002-0001-0000-000170928483";"news";"Was geschah wirklich bei der letzten Ritterschlacht?";"Hobbyforscher untersuchten einen legendären Kampf um die Vorherrschaft im Heiligen Römischen Reich. Sie fanden  mehr heraus als Historiker.";"Rekonstruktion des 28. September 1322";"2020-06-08 07:41:41";"default";TRUE;"no145_news_plus_2020-06-08H07-41-41.png"
"https://www.spiegel.de/politik/bildung-in-deutschland-das-grosse-schul-versagen-a-00000000-0002-0001-0000-000170604430";"news";"Das große Schulversagen";"Viele Schulen sind auf die Wiedereröffnung schlecht vorbereitet. Jetzt rächt sich, dass Deutschland bei der Digitalisierung hinterherhinkt. Den Preis zahlen die Schüler, die am meisten Hilfe bräuchten. Die SPIEGEL-Titelstory.";"Bildung in Deutschland";"2020-04-24 11:00:00";"default";TRUE;"no146_news_plus_2020-04-24H11-00-00.png"
"https://www.spiegel.de/psychologie/depressionen-wie-ich-versuche-mit-meiner-krankheit-zu-leben-a-00000000-0002-0001-0000-000169828743";"highlight";"Wie ich versuche, mit meiner Depression zu leben";"Vier Monate war ich in der Psychiatrie, um mein Gemüt zu stabilisieren, habe mehr als hundert Stunden Therapie hinter mir und unzählige Pillen genommen - krank bin ich noch immer.";"Erfahrungsbericht eines psychisch Kranken";"2020-03-06 17:00:00";"default";TRUE;"no147_highlight_plus_2020-03-06H17-00-00.png"
"https://www.spiegel.de/politik/ausland/donald-trump-und-die-proteste-in-den-usa-krieg-im-eigenen-land-a-05682042-5d63-4c2a-bee5-144022e6c8f4";"opinion";"Donald Trump löst die Revolution aus, vor der er sich fürchtet";"Der US-Präsident geht mit Kriegsmethoden gegen Protestierende vor. Damit setzt er seine Wiederwahl aufs Spiel.";"Polizeigewalt in den USA";"2020-06-17 13:32:14";"default";TRUE;"no148_opinion_plus_2020-06-17H13-32-14.png"
"https://prod.www.manager-magazin.de/harvard/selbstmanagement/leistungstraeger-in-der-krise-was-tun-sie-fuer-sich-a-00000000-0002-0001-0000-000171530714";"news";"Was tun Sie für sich?";"Während einer fundamentalen Krise kommen Leistungsträger mit ungewohnten Gefühlen wie Scham, Trauer oder Zweifel in Kontakt. Anstatt die eigenen Emotionen wie gewohnt auszublenden und in den Machermodus umzuschalten, empfiehlt sich eine ganz andere Herangehensweise.";"Selbstmanagement";"2020-06-30 17:14:36";"default";TRUE;"no149_news_plus_2020-06-30H17-14-36.png"
"https://www.manager-magazin.de/unternehmen/mcdonald-s-praegt-die-megatrends-der-gastronomie-a-00000000-0002-0001-0000-000171738370";"news";"Warum die Gastronomie teurer und maschineller wird";"McDonald's ist eine Gewinnmaschine mit mehr als 100 Milliarden Dollar Umsatz. Auf die neuen Bedingungen für die Branche ist sie längst perfekt vorbereitet.";"McDonald's setzt Megatrends";"2020-07-06 16:45:00";"default";TRUE;"no150_news_plus_2020-07-06H16-45-00.png"
"https://www.spiegel.de/wirtschaft/service/teure-kredite-wie-immobilienbesitzer-sich-gegen-banken-behaupten-koennen-a-40f20ca9-a606-4b19-a7e2-6dfce484cbf2";"news";"Wie Immobilienbesitzer sich gegen Banken behaupten können";"Wenn Hauseigentümer teure Kredite vorzeitig kündigen, sollen sie meist üppige Vertragsstrafen zahlen. Doch oft sind die Forderungen überhöht. Mit diesen Tipps können sich Betroffene wehren.";"Vorfälligkeitsentschädigung";"2020-03-22 06:37:17";"default";TRUE;"no151_news_plus_2020-03-22H06-37-17.png"
"https://www.spiegel.de/politik/deutschland/afd-der-voelkische-fluegel-will-die-partei-uebernehmen-die-stuermer-a-00000000-0002-0001-0000-000171037291";"news";"Die Stürmer";"Der aus der AfD geworfene Andreas Kalbitz sieht sich als \"\"Bauernopfer\"\", Björn Höcke spricht von \"\"Verrat\"\". Steht die Partei jetzt vor der Spaltung? DIE SPIEGEL-Titelstory.";"Der völkische \"\"Flügel\"\" will die AfD übernehmen";"2020-05-22 08:18:00";"default";TRUE;"no152_news_plus_2020-05-22H08-18-00.png"
"https://www.spiegel.de/wirtschaft/starkoch-franz-keller-wir-werden-immer-fetter-aber-unser-koerper-verhungert-a-00000000-0002-0001-0000-000169705058";"news";"\"\"Wir werden immer fetter, aber unser Körper verhungert\"\"";"Für Franz Keller ist die Lebensmittelindustrie in Wahrheit eine \"\"Sterbensmittelindustrie\"\". Sein Rat: Wer selbst kocht, nimmt die Verantwortung über das eigene Leben in die Hand - und verbessert die Welt.";"Früher Sternekoch, heute Bauer";"2020-03-04 23:49:00";"default";TRUE;"no153_news_plus_2020-03-04H23-49-00.png"
"https://www.spiegel.de/politik/ausland/hongkong-fuer-mich-hat-diese-woche-die-herrschaft-der-angst-eingesetzt-a-00000000-0002-0001-0000-000171875126";"news";"\"\"Für mich hat diese Woche die Herrschaft der Angst eingesetzt\"\"";"Sie ist eine der prominentesten Politikerinnen Hongkongs. Hier beschreibt Claudia Mo, wie sie Chinas Sicherheitsgesetz empfindet: als rollten unsichtbare Panzer durch die Straßen.";"Oppositionspolitikerin";"2020-07-03 16:00:00";"default";TRUE;"no154_news_plus_2020-07-03H16-00-00.png"
"https://www.spiegel.de/politik/deutschland/annegret-kramp-karrenbauer-gibt-als-cdu-chefin-auf-45-sekunden-schweigen-dann-kam-es-zum-streit-a-ab6d3508-6fc7-4f76-8cde-29f1aa744e3d";"news";"45 Sekunden Schweigen - dann kam es zum Streit";"Annegret Kramp-Karrenbauer kapituliert, die CDU stürzt in die Krise, der Machtkampf um ihre Nachfolge ist eröffnet. Lesen Sie hier, was in der entscheidenden Sitzung geschah.";"Rekonstruktion des Kramp-Karrenbauer-Rückzugs";"2020-02-10 23:02:00";"default";TRUE;"no155_news_plus_2020-02-10H23-02-00.png"
